"Tanggal","Origin (UTC)","Lintang","Bujur","Magnitudo","Depth","Ket","Terasa","Dampak","Sumber","Petugas","Created","Updated","Actions"
"01-07-2021","14:23:19.2","-2.39","139.61","2.8","53","91 km BaratLaut KAB-JAYAPURA-PAPUA","tidak","","angkasa","umum","","","Press Release 	  		  			  		  		 	 Edit  		  		  			  		  		 Delete"
"01-07-2021","21:50:58.6","-0.69","131.73","2.3","10","53 km TimurLaut KOTA-SORONG-PAPUABRT","tidak","","angkasa","umum","","","Press Release 	  		  			  		  		 	 Edit  		  		  			  		  		 Delete"
"01-07-2021","22:14:02.8","-4.28","134.01","3.4","10","110 km Tenggara KAIMANA-PAPUABRT","tidak","","angkasa","umum","","","Press Release 	  		  			  		  		 	 Edit  		  		  			  		  		 Delete"
"02-07-2021","02:05:02.6","-2.41","134.11","4.1","10","55 km BaratLaut TELUKWONDAMA-PAPUABRT","tidak","","angkasa","umum","","","Press Release 	  		  			  		  		 	 Edit  		  		  			  		  		 Delete"
"02-07-2021","04:47:55.1","-2.61","139.42","4.6","57","109 km BaratDaya KAB-JAYAPURA-PAPUA","tidak","","angkasa","umum","","","Press Release 	  		  			  		  		 	 Edit  		  		  			  		  		 Delete"
"02-07-2021","09:22:54.4","-3.21","134.05","2.9","10","15 km TimurLaut KAIMANA-PAPUABRT","tidak","","angkasa","umum","","","Press Release 	  		  			  		  		 	 Edit  		  		  			  		  		 Delete"
"02-07-2021","17:46:47.8","-3.16","135.22","3.6","10","71 km BaratLaut NABIRE-PAPUA","tidak","","angkasa","purnama","","2021-07-02 17:59:04","Press Release 	  		  			  		  		 	 Edit  		  		  			  		  		 Delete"
"02-07-2021","18:16:52.8","-3.16","135.22","3.1","10","71 km BaratLaut NABIRE-PAPUA","tidak","","angkasa","purnama","","2021-07-02 18:34:52","Press Release 	  		  			  		  		 	 Edit  		  		  			  		  		 Delete"
"03-07-2021","11:27:19.8","-1.88","135.77","3.1","10","47 km BaratDaya KEP-YAPEN-PAPUA","tidak","","angkasa","umum","","","Press Release 	  		  			  		  		 	 Edit  		  		  			  		  		 Delete"
"03-07-2021","16:04:03.9","-2.73","136.82","3.6","9","21 km TimurLaut WAROPEN-PAPUA","tidak","","angkasa","umum","","","Press Release 	  		  			  		  		 	 Edit  		  		  			  		  		 Delete"
"04-07-2021","01:07:51.3","-3.66","133.70","4.0","10","49 km BaratDaya KAIMANA-PAPUABRT","tidak","","angkasa","umum","","","Press Release 	  		  			  		  		 	 Edit  		  		  			  		  		 Delete"
"05-07-2021","04:41:20.1","-0.32","132.61","3.0","10","57 km TimurLaut TAMBRAUW-PAPUABRT","tidak","","angkasa","umum","","","Press Release 	  		  			  		  		 	 Edit  		  		  			  		  		 Delete"
"05-07-2021","10:19:19.0","-2.10","140.69","3.4","10","52 km TimurLaut KOTA-JAYAPURA-PAPUA","tidak","","angkasa","umum","","","Press Release 	  		  			  		  		 	 Edit  		  		  			  		  		 Delete"
"05-07-2021","19:22:07.7","-1.73","139.03","4.5","10","34 km TimurLaut SARMI-PAPUA","tidak","","angkasa","umum","","","Press Release 	  		  			  		  		 	 Edit  		  		  			  		  		 Delete"
"05-07-2021","19:35:07.0","-1.70","138.99","4.5","10","32 km TimurLaut SARMI-PAPUA","tidak","","angkasa","umum","","","Press Release 	  		  			  		  		 	 Edit  		  		  			  		  		 Delete"
"06-07-2021","01:06:49.7","-1.58","134.27","3.6","29","16 km Tenggara RANSIKI-PAPUABRT","dirasakan","dirasakan II MMI di Ransiki","angkasa","purnama","","2021-07-06 04:25:47","Press Release 	  		  			  		  		 	 Edit  		  		  			  		  		 Delete"
"06-07-2021","00:48:22.0","-4.23","133.84","3.0","10","105 km BaratDaya KAIMANA-PAPUABRT","tidak","","pgr v","purnama","2021-07-06 01:23:17","2021-07-06 01:23:30","Press Release 	  		  			  		  		 	 Edit  		  		  			  		  		 Delete"
"06-07-2021","02:19:41.2","-2.04","140.79","3.1","10","62 km TimurLaut KOTA-JAYAPURA-PAPUA","tidak","","angkasa","purnama","","2021-07-06 04:25:57","Press Release 	  		  			  		  		 	 Edit  		  		  			  		  		 Delete"
"06-07-2021","04:11:00.1","-3.76","133.57","2.9","10","67 km BaratDaya KAIMANA-PAPUABRT","tidak","","pgr v","purnama","2021-07-06 04:24:52","2021-07-06 04:25:06","Press Release 	  		  			  		  		 	 Edit  		  		  			  		  		 Delete"
"06-07-2021","07:47:19.4","-2.18","140.40","3.1","10","45 km BaratLaut KAB-JAYAPURA-PAPUA","tidak","","angkasa","purnama","","2021-07-06 08:14:40","Press Release 	  		  			  		  		 	 Edit  		  		  			  		  		 Delete"
"06-07-2021","07:38:10.7","-3.23","135.19","3.4","22","70 km BaratLaut NABIRE-PAPUA","tidak","","pgr v","purnama","2021-07-06 07:58:12","2021-07-06 08:14:28","Press Release 	  		  			  		  		 	 Edit  		  		  			  		  		 Delete"
"06-07-2021","11:56:37.8","-0.13","132.86","2.8","10","89 km TimurLaut TAMBRAUW-PAPUABRT","tidak","","angkasa","umum","","","Press Release 	  		  			  		  		 	 Edit  		  		  			  		  		 Delete"
"06-07-2021","17:27:10.2","-2.19","139.33","3.5","30","74 km Tenggara SARMI-PAPUA","tidak","","angkasa","umum","","","Press Release 	  		  			  		  		 	 Edit  		  		  			  		  		 Delete"
"06-07-2021","19:02:14.6","-0.04","132.61","3.1","10","86 km TimurLaut TAMBRAUW-PAPUABRT","tidak","","angkasa","umum","","","Press Release 	  		  			  		  		 	 Edit  		  		  			  		  		 Delete"
"07-07-2021","12:30:49","-2.91","139.60","5.2","98","96 km BaratDaya KAB-JAYAPURA-PAPUA","dirasakan","dirasakan III MMI di Wamena","bmkg","purnama","","2021-08-03 00:38:24","Press Release 	  		  			  		  		 	 Edit  		  		  			  		  		 Delete"
"07-07-2021","23:30:24.3","-1.46","133.89","3.1","66","30 km BaratLaut RANSIKI-PAPUABRT","tidak","","angkasa","umum","","","Press Release 	  		  			  		  		 	 Edit  		  		  			  		  		 Delete"
"08-07-2021","00:50:47.0","-4.89","133.74","3.5","10","92 km BaratLaut DOBO-MALUKU","tidak","","angkasa","umum","","","Press Release 	  		  			  		  		 	 Edit  		  		  			  		  		 Delete"
"08-07-2021","03:05:27.5","-3.19","139.69","4.5","20","71 km TimurLaut YALIMO-PAPUA","tidak","","angkasa","umum","","","Press Release 	  		  			  		  		 	 Edit  		  		  			  		  		 Delete"
"08-07-2021","16:29:49.5","-2.80","140.52","2.0","10","27 km Tenggara KAB-JAYAPURA-PAPUA","tidak","","angkasa","umum","","","Press Release 	  		  			  		  		 	 Edit  		  		  			  		  		 Delete"
"08-07-2021","23:55:10.5","-3.72","140.61","3.9","10","45 km BaratDaya KEEROM-PAPUA","tidak","","angkasa","umum","","","Press Release 	  		  			  		  		 	 Edit  		  		  			  		  		 Delete"
"09-07-2021","00:53:07.8","-2.78","140.59","2.3","10","24 km BaratDaya KOTA-JAYAPURA-PAPUA","tidak","","angkasa","umum","","","Press Release 	  		  			  		  		 	 Edit  		  		  			  		  		 Delete"
"09-07-2021","05:24:23.6","-2.41","139.18","2.9","10","78 km Tenggara SARMI-PAPUA","tidak","","angkasa","umum","","","Press Release 	  		  			  		  		 	 Edit  		  		  			  		  		 Delete"
"09-07-2021","13:31:12.2","-0.03","123.85","5.7","108","200 km BaratDaya MANADO-SULUT","tidak","","angkasa","umum","","","Press Release 	  		  			  		  		 	 Edit  		  		  			  		  		 Delete"
"09-07-2021","15:47:38.6","-2.64","140.97","2.7","24","41 km Tenggara KOTA-JAYAPURA-PAPUA","tidak","","angkasa","umum","","","Press Release 	  		  			  		  		 	 Edit  		  		  			  		  		 Delete"
"09-07-2021","23:34:07.7","-1.53","139.22","4.1","10","63 km TimurLaut SARMI-PAPUA","tidak","","angkasa","umum","","","Press Release 	  		  			  		  		 	 Edit  		  		  			  		  		 Delete"
"09-07-2021","23:51:00.1","-1.50","139.22","3.8","12","65 km TimurLaut SARMI-PAPUA","tidak","","angkasa","umum","","","Press Release 	  		  			  		  		 	 Edit  		  		  			  		  		 Delete"
"10-07-2021","02:26:04.1","-2.97","139.07","3.6","28","77 km TimurLaut KOBAKMA-PAPUA","tidak","","angkasa","umum","","","Press Release 	  		  			  		  		 	 Edit  		  		  			  		  		 Delete"
"10-07-2021","04:03:37.1","-1.47","139.23","2.9","10","68 km TimurLaut SARMI-PAPUA","tidak","","angkasa","umum","","","Press Release 	  		  			  		  		 	 Edit  		  		  			  		  		 Delete"
"10-07-2021","05:58:38.7","-2.32","140.19","2.5","10","38 km BaratLaut KAB-JAYAPURA-PAPUA","tidak","","angkasa","umum","","","Press Release 	  		  			  		  		 	 Edit  		  		  			  		  		 Delete"
"10-07-2021","08:05:27.0","-1.62","139.15","4.3","10","51 km TimurLaut SARMI-PAPUA","tidak","","angkasa","umum","","","Press Release 	  		  			  		  		 	 Edit  		  		  			  		  		 Delete"
"10-07-2021","08:51:25.2","-1.71","139.15","3.8","10","47 km TimurLaut SARMI-PAPUA","tidak","","angkasa","umum","","","Press Release 	  		  			  		  		 	 Edit  		  		  			  		  		 Delete"
"10-07-2021","14:49:26.1","-1.63","139.27","4.0","10","63 km TimurLaut SARMI-PAPUA","tidak","","angkasa","umum","","","Press Release 	  		  			  		  		 	 Edit  		  		  			  		  		 Delete"
"11-07-2021","00:00:25","-4.26","134.03","3.9","27","108 km Tenggara KAIMANA-PAPUABRT","dirasakan","dirasakan II MMI di Kaimana","pgr v","purnama","2021-07-11 01:05:48","2021-07-11 01:05:48","Press Release 	  		  			  		  		 	 Edit  		  		  			  		  		 Delete"
"11-07-2021","05:19:08.8","-3.77","133.71","2.5","10","60 km BaratDaya KAIMANA-PAPUABRT","tidak","","pgr v","purnama","2021-07-11 07:19:37","2021-07-11 07:19:49","Press Release 	  		  			  		  		 	 Edit  		  		  			  		  		 Delete"
"11-07-2021","12:23:57.2","0.00","132.23","2.9","10","89 km BaratLaut TAMBRAUW-PAPUABRT","tidak","","angkasa","umum","","","Press Release 	  		  			  		  		 	 Edit  		  		  			  		  		 Delete"
"11-07-2021","17:41:48.9","-4.68","140.76","2.8","83","30 km Tenggara PEG-BINTANG-PAPUA","tidak","","angkasa","umum","","","Press Release 	  		  			  		  		 	 Edit  		  		  			  		  		 Delete"
"11-07-2021","19:34:15.9","-2.76","139.81","2.6","37","69 km BaratDaya KAB-JAYAPURA-PAPUA","tidak","","angkasa","umum","","","Press Release 	  		  			  		  		 	 Edit  		  		  			  		  		 Delete"
"12-07-2021","03:51:07.8","-3.54","140.15","3.4","29","71 km BaratDaya KEEROM-PAPUA","tidak","","angkasa","umum","","","Press Release 	  		  			  		  		 	 Edit  		  		  			  		  		 Delete"
"12-07-2021","09:17:52.0","-2.64","140.32","3.1","29","11 km BaratDaya KAB-JAYAPURA-PAPUA","tidak","","angkasa","umum","","","Press Release 	  		  			  		  		 	 Edit  		  		  			  		  		 Delete"
"12-07-2021","12:51:54.6","-3.69","140.33","5.0","15","61 km BaratDaya KEEROM-PAPUA","tidak","","angkasa","purnama","","2021-07-12 21:27:12","Press Release 	  		  			  		  		 	 Edit  		  		  			  		  		 Delete"
"12-07-2021","21:31:34.8","-2.91","140.29","2.6","10","38 km BaratDaya KAB-JAYAPURA-PAPUA","tidak","","angkasa","purnama","","2021-07-12 21:45:05","Press Release 	  		  			  		  		 	 Edit  		  		  			  		  		 Delete"
"13-07-2021","07:40:13.2","-1.42","139.23","4.2","10","72 km TimurLaut SARMI-PAPUA","tidak","","angkasa","umum","","","Press Release 	  		  			  		  		 	 Edit  		  		  			  		  		 Delete"
"13-07-2021","12:17:14.9","-4.36","129.73","4.1","4","187 km Tenggara AMBON-MALUKU","tidak","","angkasa","umum","","","Press Release 	  		  			  		  		 	 Edit  		  		  			  		  		 Delete"
"13-07-2021","12:28:53.2","-1.17","138.99","3.7","23","80 km TimurLaut SARMI-PAPUA","tidak","","angkasa","umum","","","Press Release 	  		  			  		  		 	 Edit  		  		  			  		  		 Delete"
"13-07-2021","17:44:12.9","-3.25","140.54","2.8","60","27 km BaratLaut KEEROM-PAPUA","tidak","","angkasa","umum","","","Press Release 	  		  			  		  		 	 Edit  		  		  			  		  		 Delete"
"13-07-2021","22:40:20.6","-2.62","140.39","2.6","25","4 km BaratDaya KAB-JAYAPURA-PAPUA","tidak","","angkasa","umum","","","Press Release 	  		  			  		  		 	 Edit  		  		  			  		  		 Delete"
"14-07-2021","08:43:19.4","-0.71","132.51","2.9","10","15 km TimurLaut TAMBRAUW-PAPUABRT","tidak","","angkasa","umum","","","Press Release 	  		  			  		  		 	 Edit  		  		  			  		  		 Delete"
"14-07-2021","10:37:02.3","-1.29","134.26","4.7","10","25 km TimurLaut RANSIKI-PAPUABRT","dirasakan","dirasakan di daerah Ransiki, Manokwari, dan Oransb[...]","angkasa","netty","","2021-07-15 23:39:01","Press Release 	  		  			  		  		 	 Edit  		  		  			  		  		 Delete"
"14-07-2021","11:20:52.1","-3.94","137.71","3.6","20","14 km Tenggara PUNCAK-PAPUA","tidak","","angkasa","umum","","","Press Release 	  		  			  		  		 	 Edit  		  		  			  		  		 Delete"
"14-07-2021","16:29:43.8","-4.04","136.42","3.8","10","7 km BaratLaut DEIYAI-PAPUA","tidak","","angkasa","umum","","","Press Release 	  		  			  		  		 	 Edit  		  		  			  		  		 Delete"
"14-07-2021","17:04:11.4","-2.31","140.11","3.0","10","45 km BaratLaut KAB-JAYAPURA-PAPUA","tidak","","angkasa","umum","","","Press Release 	  		  			  		  		 	 Edit  		  		  			  		  		 Delete"
"14-07-2021","22:07:37.5","-1.96","138.71","2.7","10","13 km BaratDaya SARMI-PAPUA","tidak","","angkasa","umum","","","Press Release 	  		  			  		  		 	 Edit  		  		  			  		  		 Delete"
"14-07-2021","23:31:56.7","-3.02","139.72","3.4","28","90 km BaratDaya KAB-JAYAPURA-PAPUA","tidak","","angkasa","umum","","","Press Release 	  		  			  		  		 	 Edit  		  		  			  		  		 Delete"
"15-07-2021","03:23:54.1","-2.60","140.57","2.6","10","6 km BaratDaya KOTA-JAYAPURA-PAPUA","tidak","","angkasa","umum","","","Press Release 	  		  			  		  		 	 Edit  		  		  			  		  		 Delete"
"15-07-2021","03:33:35.4","-0.65","133.56","3.0","10","45 km BaratLaut PEGUNUNGANARFAK-PAPUABRT","tidak","","angkasa","umum","","","Press Release 	  		  			  		  		 	 Edit  		  		  			  		  		 Delete"
"15-07-2021","03:55:54.1","-2.35","140.21","2.5","10","34 km BaratLaut KAB-JAYAPURA-PAPUA","tidak","","angkasa","umum","","","Press Release 	  		  			  		  		 	 Edit  		  		  			  		  		 Delete"
"15-07-2021","06:36:27.0","-2.55","138.83","3.1","27","60 km Tenggara MAMBERAMOTENGAH-PAPUA","tidak","","angkasa","umum","","","Press Release 	  		  			  		  		 	 Edit  		  		  			  		  		 Delete"
"15-07-2021","07:57:50.3","-0.96","131.28","2.8","10","9 km BaratDaya KOTA-SORONG-PAPUABRT","tidak","","angkasa","umum","","","Press Release 	  		  			  		  		 	 Edit  		  		  			  		  		 Delete"
"15-07-2021","09:00:56.5","-2.71","140.57","2.2","8","17 km BaratDaya KOTA-JAYAPURA-PAPUA","tidak","","angkasa","umum","","","Press Release 	  		  			  		  		 	 Edit  		  		  			  		  		 Delete"
"15-07-2021","09:37:11.0","-1.53","134.27","2.9","46","13 km Tenggara RANSIKI-PAPUABRT","tidak","","angkasa","umum","","","Press Release 	  		  			  		  		 	 Edit  		  		  			  		  		 Delete"
"16-07-2021","05:31:28.4","-0.54","131.26","4.5","10","38 km BaratLaut KOTA-SORONG-PAPUABRT","tidak","","angkasa","purnama","","2021-07-21 06:29:31","Press Release 	  		  			  		  		 	 Edit  		  		  			  		  		 Delete"
"16-07-2021","13:42:16.3","-1.20","134.71","3.0","10","35 km BaratDaya Pulau Numfor - PAPUA","tidak","","angkasa","umum","","","Press Release 	  		  			  		  		 	 Edit  		  		  			  		  		 Delete"
"16-07-2021","17:38:42.0","-2.80","139.23","2.4","10","98 km TimurLaut KOBAKMA-PAPUA","tidak","","angkasa","umum","","","Press Release 	  		  			  		  		 	 Edit  		  		  			  		  		 Delete"
"16-07-2021","20:01:46.5","-2.28","140.39","2.1","10","34 km BaratLaut KAB-JAYAPURA-PAPUA","tidak","","angkasa","umum","","","Press Release 	  		  			  		  		 	 Edit  		  		  			  		  		 Delete"
"16-07-2021","20:46:36.3","-2.62","140.58","1.6","10","7 km BaratDaya KOTA-JAYAPURA-PAPUA","tidak","","angkasa","umum","","","Press Release 	  		  			  		  		 	 Edit  		  		  			  		  		 Delete"
"17-07-2021","11:46:25.4","-3.40","140.08","2.8","10","76 km BaratDaya KEEROM-PAPUA","tidak","","angkasa","umum","","","Press Release 	  		  			  		  		 	 Edit  		  		  			  		  		 Delete"
"17-07-2021","12:50:10.2","-4.44","138.07","4.3","10","19 km BaratDaya NDUGA-PAPUA","tidak","","angkasa","umum","","","Press Release 	  		  			  		  		 	 Edit  		  		  			  		  		 Delete"
"18-07-2021","06:18:18.7","-2.03","133.99","3.3","10","54 km TimurLaut TELUKBINTUNI-PAPUABRT","tidak","","angkasa","umum","","","Press Release 	  		  			  		  		 	 Edit  		  		  			  		  		 Delete"
"18-07-2021","06:50:32.9","-3.19","134.19","2.9","10","29 km TimurLaut KAIMANA-PAPUABRT","tidak","","angkasa","umum","","","Press Release 	  		  			  		  		 	 Edit  		  		  			  		  		 Delete"
"18-07-2021","10:48:44.6","-1.99","140.17","2.8","16","71 km BaratLaut KAB-JAYAPURA-PAPUA","tidak","","angkasa","umum","","","Press Release 	  		  			  		  		 	 Edit  		  		  			  		  		 Delete"
"18-07-2021","12:39:40.0","-1.93","138.87","3.1","21","16 km Tenggara SARMI-PAPUA","tidak","","angkasa","umum","","","Press Release 	  		  			  		  		 	 Edit  		  		  			  		  		 Delete"
"18-07-2021","13:42:55.3","-2.18","140.05","2.3","12","60 km BaratLaut KAB-JAYAPURA-PAPUA","tidak","","angkasa","umum","","","Press Release 	  		  			  		  		 	 Edit  		  		  			  		  		 Delete"
"18-07-2021","14:27:16.7","-2.34","141.05","2.9","10","55 km TimurLaut KOTA-JAYAPURA-PAPUA","tidak","","angkasa","umum","","","Press Release 	  		  			  		  		 	 Edit  		  		  			  		  		 Delete"
"18-07-2021","14:32:35.1","-2.74","141.08","2.4","27","56 km Tenggara KOTA-JAYAPURA-PAPUA","tidak","","angkasa","umum","","","Press Release 	  		  			  		  		 	 Edit  		  		  			  		  		 Delete"
"18-07-2021","21:58:07.7","-2.26","140.12","2.7","10","48 km BaratLaut KAB-JAYAPURA-PAPUA","tidak","","angkasa","umum","","","Press Release 	  		  			  		  		 	 Edit  		  		  			  		  		 Delete"
"19-07-2021","00:08:24.1","-4.12","138.82","2.6","10","13 km Tenggara JAYAWIJAYA-PAPUA","tidak","","angkasa","umum","","","Press Release 	  		  			  		  		 	 Edit  		  		  			  		  		 Delete"
"19-07-2021","12:48:40.8","-4.87","139.51","3.1","10","42 km BaratDaya YAHUKIMO-PAPUA","tidak","","angkasa","umum","","","Press Release 	  		  			  		  		 	 Edit  		  		  			  		  		 Delete"
"19-07-2021","17:18:50.7","-0.53","134.09","3.0","10","55 km TimurLaut PEGUNUNGANARFAK-PAPUABRT","tidak","","angkasa","umum","","","Press Release 	  		  			  		  		 	 Edit  		  		  			  		  		 Delete"
"19-07-2021","17:24:34.9","-3.31","135.33","3.5","10","52 km BaratLaut NABIRE-PAPUA","tidak","","angkasa","umum","","","Press Release 	  		  			  		  		 	 Edit  		  		  			  		  		 Delete"
"19-07-2021","17:44:04.2","-3.39","137.75","3.2","10","12 km BaratLaut PUNCAKJAYA-PAPUA","tidak","","angkasa","umum","","","Press Release 	  		  			  		  		 	 Edit  		  		  			  		  		 Delete"
"20-07-2021","10:51:44.4","-4.98","138.82","3.0","10","47 km TimurLaut ASMAT-PAPUA","tidak","","angkasa","umum","","","Press Release 	  		  			  		  		 	 Edit  		  		  			  		  		 Delete"
"20-07-2021","15:10:52.2","-2.50","140.74","3.3","10","16 km TimurLaut KOTA-JAYAPURA-PAPUA","tidak","","angkasa","umum","","","Press Release 	  		  			  		  		 	 Edit  		  		  			  		  		 Delete"
"21-07-2021","04:46:07.9","-2.00","133.50","2.8","10","12 km BaratLaut TELUKBINTUNI-PAPUABRT","tidak","","pgr v","purnama","2021-07-21 06:27:21","2021-07-21 06:27:34","Press Release 	  		  			  		  		 	 Edit  		  		  			  		  		 Delete"
"21-07-2021","13:46:52.9","-2.25","140.20","2.5","7","43 km BaratLaut KAB-JAYAPURA-PAPUA","tidak","","angkasa","umum","","","Press Release 	  		  			  		  		 	 Edit  		  		  			  		  		 Delete"
"21-07-2021","15:58:34.1","-1.25","137.87","3.1","10","118 km BaratLaut KASONAWEJA-PAPUA","tidak","","angkasa","umum","","","Press Release 	  		  			  		  		 	 Edit  		  		  			  		  		 Delete"
"21-07-2021","18:54:33.9","-4.02","133.67","3.3","10","87 km BaratDaya KAIMANA-PAPUABRT","tidak","","angkasa","umum","","","Press Release 	  		  			  		  		 	 Edit  		  		  			  		  		 Delete"
"21-07-2021","20:34:33.9","-0.63","133.33","3.2","10","67 km BaratLaut PEGUNUNGANARFAK-PAPUABRT","tidak","","angkasa","umum","","","Press Release 	  		  			  		  		 	 Edit  		  		  			  		  		 Delete"
"21-07-2021","23:13:49.4","-0.59","132.18","3.8","10","32 km BaratLaut TAMBRAUW-PAPUABRT","tidak","","angkasa","umum","","","Press Release 	  		  			  		  		 	 Edit  		  		  			  		  		 Delete"
"22-07-2021","06:13:10.7","-1.42","136.96","3.7","26","95 km TimurLaut KEP-YAPEN-PAPUA","tidak","","angkasa","umum","","","Press Release 	  		  			  		  		 	 Edit  		  		  			  		  		 Delete"
"22-07-2021","12:37:28.8","-3.02","140.51","2.3","10","46 km BaratLaut KEEROM-PAPUA","tidak","","angkasa","purnama","","2021-07-22 12:45:46","Press Release 	  		  			  		  		 	 Edit  		  		  			  		  		 Delete"
"22-07-2021","09:55:15.0","-0.35","132.85","2.7","10","70 km TimurLaut TAMBRAUW-PAPUABRT","tidak","","pgr v","purnama","2021-07-22 12:45:57","2021-07-22 12:46:19","Press Release 	  		  			  		  		 	 Edit  		  		  			  		  		 Delete"
"22-07-2021","20:10:14.3","-5.10","140.53","3.0","10","60 km Tenggara PEG-BINTANG-PAPUA","tidak","","pgr v","purnama","2021-07-22 21:53:39","2021-07-22 21:53:54","Press Release 	  		  			  		  		 	 Edit  		  		  			  		  		 Delete"
"22-07-2021","23:03:59.6","-2.28","140.11","3.7","8","47 km BaratLaut KAB-JAYAPURA-PAPUA","tidak","","angkasa","umum","","","Press Release 	  		  			  		  		 	 Edit  		  		  			  		  		 Delete"
"23-07-2021","00:10:26.8","-0.68","131.83","3.7","10","62 km TimurLaut KAB-SORONG-PAPUABRT","tidak","","angkasa","umum","","","Press Release 	  		  			  		  		 	 Edit  		  		  			  		  		 Delete"
"23-07-2021","16:21:47.3","-2.35","138.46","4.0","10","16 km TimurLaut MAMBERAMOTENGAH-PAPUA","tidak","","angkasa","umum","","","Press Release 	  		  			  		  		 	 Edit  		  		  			  		  		 Delete"
"23-07-2021","23:14:17.0","-1.55","138.48","3.0","10","45 km BaratLaut SARMI-PAPUA","tidak","","angkasa","umum","","","Press Release 	  		  			  		  		 	 Edit  		  		  			  		  		 Delete"
"23-07-2021","23:22:59.0","-1.99","138.71","3.9","10","16 km BaratDaya SARMI-PAPUA","tidak","","angkasa","umum","","","Press Release 	  		  			  		  		 	 Edit  		  		  			  		  		 Delete"
"24-07-2021","06:15:34.3","-3.04","140.07","2.5","10","63 km BaratDaya KAB-JAYAPURA-PAPUA","tidak","","angkasa","umum","","","Press Release 	  		  			  		  		 	 Edit  		  		  			  		  		 Delete"
"24-07-2021","13:11:48.0","-0.69","133.19","3.1","10","77 km BaratLaut PEGUNUNGANARFAK-PAPUABRT","tidak","","angkasa","umum","","","Press Release 	  		  			  		  		 	 Edit  		  		  			  		  		 Delete"
"24-07-2021","22:36:19.2","-2.63","133.91","2.6","10","52 km BaratLaut TELUKWONDAMA-PAPUABRT","tidak","","angkasa","umum","","","Press Release 	  		  			  		  		 	 Edit  		  		  			  		  		 Delete"
"24-07-2021","22:47:01.5","-2.71","140.46","2.4","10","15 km Tenggara KAB-JAYAPURA-PAPUA","tidak","","angkasa","umum","","","Press Release 	  		  			  		  		 	 Edit  		  		  			  		  		 Delete"
"24-07-2021","23:36:09.2","-4.95","134.05","3.4","10","71 km BaratLaut DOBO-MALUKU","tidak","","angkasa","umum","","","Press Release 	  		  			  		  		 	 Edit  		  		  			  		  		 Delete"
"25-07-2021","00:00:36.4","-2.38","140.35","2.4","10","23 km BaratLaut KAB-JAYAPURA-PAPUA","tidak","","angkasa","umum","","","Press Release 	  		  			  		  		 	 Edit  		  		  			  		  		 Delete"
"25-07-2021","08:26:51.2","-2.32","138.90","4.4","38","55 km Tenggara SARMI-PAPUA","tidak","","angkasa","umum","","","Press Release 	  		  			  		  		 	 Edit  		  		  			  		  		 Delete"
"25-07-2021","23:19:58.2","-2.43","140.48","2.9","10","19 km TimurLaut KAB-JAYAPURA-PAPUA","tidak","","angkasa","purnama","","2021-07-26 08:34:39","Press Release 	  		  			  		  		 	 Edit  		  		  			  		  		 Delete"
"26-07-2021","05:28:13.2","-2.49","140.76","2.5","10","19 km TimurLaut KOTA-JAYAPURA-PAPUA","tidak","","angkasa","purnama","","2021-07-26 08:35:03","Press Release 	  		  			  		  		 	 Edit  		  		  			  		  		 Delete"
"26-07-2021","05:34:43.4","-2.39","140.79","2.6","10","28 km TimurLaut KOTA-JAYAPURA-PAPUA","tidak","","angkasa","purnama","","2021-07-26 05:47:55","Press Release 	  		  			  		  		 	 Edit  		  		  			  		  		 Delete"
"26-07-2021","06:09:48.5","-2.98","140.16","2.7","10","52 km BaratDaya KAB-JAYAPURA-PAPUA","tidak","","angkasa","purnama","","2021-07-26 08:35:12","Press Release 	  		  			  		  		 	 Edit  		  		  			  		  		 Delete"
"26-07-2021","06:54:21.1","-3.95","133.99","3.6","10","74 km Tenggara KAIMANA-PAPUABRT","tidak","","angkasa","purnama","","2021-07-26 08:35:21","Press Release 	  		  			  		  		 	 Edit  		  		  			  		  		 Delete"
"26-07-2021","07:53:47.8","-2.93","140.62","2.7","10","41 km Tenggara KOTA-JAYAPURA-PAPUA","tidak","","angkasa","purnama","2021-07-26 08:33:41","2021-07-26 08:35:28","Press Release 	  		  			  		  		 	 Edit  		  		  			  		  		 Delete"
"26-07-2021","02:23:56.8","-3.16","133.15","2.7","10","16 km Tenggara FAKFAK-PAPUABRT","tidak","","angkasa","purnama","2021-07-26 08:34:11","2021-07-26 08:34:53","Press Release 	  		  			  		  		 	 Edit  		  		  			  		  		 Delete"
"26-07-2021","14:26:47.8","-2.21","140.11","3.7","10","53 km BaratLaut KAB-JAYAPURA-PAPUA","tidak","","angkasa","umum","","","Press Release 	  		  			  		  		 	 Edit  		  		  			  		  		 Delete"
"26-07-2021","16:07:05.4","-3.09","139.09","3.1","10","64 km TimurLaut KOBAKMA-PAPUA","tidak","","angkasa","umum","","","Press Release 	  		  			  		  		 	 Edit  		  		  			  		  		 Delete"
"26-07-2021","22:04:20.0","-4.61","139.48","3.7","10","14 km BaratDaya YAHUKIMO-PAPUA","tidak","","angkasa","umum","","","Press Release 	  		  			  		  		 	 Edit  		  		  			  		  		 Delete"
"26-07-2021","23:19:27.0","-4.50","139.34","3.4","10","21 km BaratDaya YAHUKIMO-PAPUA","tidak","","angkasa","umum","","","Press Release 	  		  			  		  		 	 Edit  		  		  			  		  		 Delete"
"26-07-2021","23:28:39.8","-4.36","139.12","3.3","16","36 km Tenggara WAMENA-PAPUA","tidak","","angkasa","umum","","","Press Release 	  		  			  		  		 	 Edit  		  		  			  		  		 Delete"
"27-07-2021","07:02:07.1","-2.34","140.31","2.9","10","29 km BaratLaut KAB-JAYAPURA-PAPUA","tidak","","angkasa","umum","","","Press Release 	  		  			  		  		 	 Edit  		  		  			  		  		 Delete"
"27-07-2021","13:24:30.5","-2.94","140.21","2.2","10","45 km BaratDaya KAB-JAYAPURA-PAPUA","tidak","","angkasa","purnama","","2021-07-27 16:05:22","Press Release 	  		  			  		  		 	 Edit  		  		  			  		  		 Delete"
"27-07-2021","15:55:53.0","-2.21","140.79","2.5","10","44 km TimurLaut KOTA-JAYAPURA-PAPUA","tidak","","angkasa","purnama","","2021-07-27 16:05:52","Press Release 	  		  			  		  		 	 Edit  		  		  			  		  		 Delete"
"27-07-2021","15:15:31.8","-4.58","139.20","3.2","5","38 km BaratDaya YAHUKIMO-PAPUA","tidak","","angkasa","purnama","2021-07-27 16:04:21","2021-07-27 16:05:39","Press Release 	  		  			  		  		 	 Edit  		  		  			  		  		 Delete"
"27-07-2021","14:01:51.9","-0.85","131.92","1.9","4","53 km BaratDaya TAMBRAUW-PAPUABRT","tidak","","angkasa","purnama","2021-07-27 16:04:47","2021-07-27 16:05:31","Press Release 	  		  			  		  		 	 Edit  		  		  			  		  		 Delete"
"28-07-2021","10:38:11.7","-2.44","139.75","3.3","70","74 km BaratLaut KAB-JAYAPURA-PAPUA","tidak","","angkasa","umum","","","Press Release 	  		  			  		  		 	 Edit  		  		  			  		  		 Delete"
"30-07-2021","01:42:41.1","-2.22","138.76","3.4","10","41 km Tenggara SARMI-PAPUA","tidak","","angkasa","umum","","","Press Release 	  		  			  		  		 	 Edit  		  		  			  		  		 Delete"
"30-07-2021","01:50:57.9","-2.64","140.95","3.0","15","39 km Tenggara KOTA-JAYAPURA-PAPUA","tidak","","angkasa","umum","","","Press Release 	  		  			  		  		 	 Edit  		  		  			  		  		 Delete"
"30-07-2021","15:40:43.1","-2.11","140.81","2.9","17","55 km TimurLaut KOTA-JAYAPURA-PAPUA","tidak","","PGR V","","2021-07-30 17:39:24","2021-07-30 17:39:24","Press Release 	  		  			  		  		 	 Edit  		  		  			  		  		 Delete"
"30-07-2021","18:54:04.3","-3.21","140.13","2.8","10","72 km BaratLaut KEEROM-PAPUA","tidak","","angkasa","umum","","","Press Release 	  		  			  		  		 	 Edit  		  		  			  		  		 Delete"
"30-07-2021","23:58:27.1","-3.21","139.84","2.7","114","77 km TimurLaut YALIMO-PAPUA","tidak","","angkasa","purnama","","2021-07-31 01:38:38","Press Release 	  		  			  		  		 	 Edit  		  		  			  		  		 Delete"
"31-07-2021","01:22:43.3","-3.51","139.84","3.0","10","53 km TimurLaut YALIMO-PAPUA","tidak","","angkasa","purnama","","2021-07-31 01:38:47","Press Release 	  		  			  		  		 	 Edit  		  		  			  		  		 Delete"
"31-07-2021","05:11:53.3","-3.30","135.92","3.4","24","30 km TimurLaut NABIRE-PAPUA","tidak","","angkasa","purnama","","2021-07-31 06:24:54","Press Release 	  		  			  		  		 	 Edit  		  		  			  		  		 Delete"
"31-07-2021","06:48:05.7","-2.24","134.05","3.3","8","62 km Tenggara TELUKBINTUNI-PAPUABRT","tidak","","angkasa","umum","","","Press Release 	  		  			  		  		 	 Edit  		  		  			  		  		 Delete"
"31-07-2021","11:59:17.6","-3.86","140.36","3.8","27","73 km BaratDaya KEEROM-PAPUA","tidak","","angkasa","umum","","","Press Release 	  		  			  		  		 	 Edit  		  		  			  		  		 Delete"
"31-07-2021","14:57:21.8","-2.25","140.46","2.8","10","38 km TimurLaut KAB-JAYAPURA-PAPUA","tidak","","angkasa","umum","","","Press Release 	  		  			  		  		 	 Edit  		  		  			  		  		 Delete"
"31-07-2021","18:28:44.8","-0.66","132.64","2.7","10","31 km TimurLaut TAMBRAUW-PAPUABRT","tidak","","angkasa","umum","","","Press Release 	  		  			  		  		 	 Edit  		  		  			  		  		 Delete"
"01-08-2021","04:37:47.3","-1.37","137.12","4.0","10","114 km TimurLaut KEP-YAPEN-PAPUA","tidak","","angkasa","umum","","","Press Release 	  		  			  		  		 	 Edit  		  		  			  		  		 Delete"
"02-08-2021","05:01:23.7","-4.36","133.94","6.1","25","119 km BaratDaya KAIMANA-PAPUABRT","dirasakan","dirasakan di daerah Kaimana IV MMI","angkasa","netty","","2021-08-05 21:43:12","Press Release 	  		  			  		  		 	 Edit  		  		  			  		  		 Delete"
"02-08-2021","07:38:38.9","-3.67","133.75","3.4","24","48 km BaratDaya KAIMANA-PAPUABRT","tidak","","angkasa","umum","","","Press Release 	  		  			  		  		 	 Edit  		  		  			  		  		 Delete"
"02-08-2021","12:38:45.9","-1.82","130.97","2.8","10","97 km BaratDaya KAB-SORONG-PAPUABRT","tidak","","angkasa","umum","","","Press Release 	  		  			  		  		 	 Edit  		  		  			  		  		 Delete"
"02-08-2021","14:52:15.5","-2.85","134.42","3.8","10","11 km TimurLaut TELUKWONDAMA-PAPUABRT","tidak","","angkasa","umum","","","Press Release 	  		  			  		  		 	 Edit  		  		  			  		  		 Delete"
"02-08-2021","22:01:30.0","-2.72","134.33","3.7","8","15 km TimurLaut TELUKWONDAMA-PAPUABRT","tidak","","angkasa","umum","","","Press Release 	  		  			  		  		 	 Edit  		  		  			  		  		 Delete"
"03-08-2021","11:09:59.1","-2.85","140.38","2.6","16","30 km BaratDaya KAB-JAYAPURA-PAPUA","tidak","","angkasa","umum","","","Press Release 	  		  			  		  		 	 Edit  		  		  			  		  		 Delete"
"03-08-2021","22:12:47.9","-4.37","137.01","3.9","10","70 km TimurLaut MIMIKA-PAPUA","tidak","","angkasa","umum","","","Press Release 	  		  			  		  		 	 Edit  		  		  			  		  		 Delete"
"03-08-2021","22:30:48.3","-1.61","135.59","3.5","10","66 km BaratLaut KEP-YAPEN-PAPUA","tidak","","angkasa","purnama","","2021-08-04 09:39:09","Press Release 	  		  			  		  		 	 Edit  		  		  			  		  		 Delete"
"03-08-2021","23:07:47.5","-4.34","134.05","3.6","10","117 km Tenggara KAIMANA-PAPUABRT","tidak","","angkasa","purnama","","2021-08-04 09:39:17","Press Release 	  		  			  		  		 	 Edit  		  		  			  		  		 Delete"
"03-08-2021","23:52:29.5","-4.28","134.38","4.4","10","120 km Tenggara KAIMANA-PAPUABRT","tidak","","angkasa","purnama","","2021-08-04 09:39:25","Press Release 	  		  			  		  		 	 Edit  		  		  			  		  		 Delete"
"04-08-2021","00:14:26.1","-3.16","140.44","3.2","85","41 km BaratLaut KEEROM-PAPUA","tidak","","angkasa","purnama","","2021-08-04 09:39:32","Press Release 	  		  			  		  		 	 Edit  		  		  			  		  		 Delete"
"04-08-2021","08:01:12.4","-0.78","131.39","2.3","5","15 km TimurLaut KOTA-SORONG-PAPUABRT","tidak","","angkasa","purnama","2021-08-04 09:40:05","2021-08-04 09:40:16","Press Release 	  		  			  		  		 	 Edit  		  		  			  		  		 Delete"
"04-08-2021","09:52:06.6","-2.26","140.12","3.7","8","48 km BaratLaut KAB-JAYAPURA-PAPUA","tidak","","angkasa","umum","","","Press Release 	  		  			  		  		 	 Edit  		  		  			  		  		 Delete"
"04-08-2021","11:59:25.5","-4.39","134.13","4.5","10","124 km Tenggara KAIMANA-PAPUABRT","tidak","","angkasa","umum","","","Press Release 	  		  			  		  		 	 Edit  		  		  			  		  		 Delete"
"04-08-2021","23:20:33.8","-2.36","139.07","3.3","10","67 km Tenggara SARMI-PAPUA","tidak","","PGR V","","2021-08-04 23:57:27","2021-08-04 23:57:27","Press Release 	  		  			  		  		 	 Edit  		  		  			  		  		 Delete"
"05-08-2021","03:36:16.5","-4.29","134.09","3.6","24","113 km Tenggara KAIMANA-PAPUABRT","tidak","","angkasa","umum","","","Press Release 	  		  			  		  		 	 Edit  		  		  			  		  		 Delete"
"05-08-2021","07:13:54.5","-2.68","140.42","1.5","10","11 km Tenggara KAB-JAYAPURA-PAPUA","tidak","","angkasa","umum","","","Press Release 	  		  			  		  		 	 Edit  		  		  			  		  		 Delete"
"05-08-2021","07:57:40.7","-3.07","140.51","2.9","10","41 km BaratLaut KEEROM-PAPUA","tidak","","angkasa","umum","","","Press Release 	  		  			  		  		 	 Edit  		  		  			  		  		 Delete"
"05-08-2021","07:58:14.2","-3.03","140.48","2.9","10","47 km BaratLaut KEEROM-PAPUA","tidak","","angkasa","umum","","","Press Release 	  		  			  		  		 	 Edit  		  		  			  		  		 Delete"
"05-08-2021","09:02:04.8","-2.33","137.98","3.2","48","7 km BaratDaya KASONAWEJA-PAPUA","tidak","","angkasa","umum","","","Press Release 	  		  			  		  		 	 Edit  		  		  			  		  		 Delete"
"05-08-2021","09:21:55.0","-2.24","140.07","3.3","7","53 km BaratLaut KAB-JAYAPURA-PAPUA","tidak","","angkasa","umum","","","Press Release 	  		  			  		  		 	 Edit  		  		  			  		  		 Delete"
"05-08-2021","09:36:59.6","-2.88","140.43","1.9","10","33 km Tenggara KAB-JAYAPURA-PAPUA","tidak","","angkasa","umum","","","Press Release 	  		  			  		  		 	 Edit  		  		  			  		  		 Delete"
"05-08-2021","10:18:50.0","-2.66","138.65","3.6","13","49 km Tenggara MAMBERAMOTENGAH-PAPUA","tidak","","angkasa","umum","","","Press Release 	  		  			  		  		 	 Edit  		  		  			  		  		 Delete"
"05-08-2021","10:20:26.3","-2.32","140.49","2.9","10","30 km BaratLaut KOTA-JAYAPURA-PAPUA","tidak","","angkasa","umum","","","Press Release 	  		  			  		  		 	 Edit  		  		  			  		  		 Delete"
"05-08-2021","15:40:38.2","-2.89","140.42","2.4","20","34 km Tenggara KAB-JAYAPURA-PAPUA","tidak","","angkasa","purnama","","2021-08-05 16:07:38","Press Release 	  		  			  		  		 	 Edit  		  		  			  		  		 Delete"
"05-08-2021","15:50:04.2","-2.93","140.41","2.0","10","39 km Tenggara KAB-JAYAPURA-PAPUA","tidak","","angkasa","purnama","","2021-08-05 16:07:48","Press Release 	  		  			  		  		 	 Edit  		  		  			  		  		 Delete"
"05-08-2021","16:29:03.9","-4.27","134.02","3.8","10","109 km Tenggara KAIMANA-PAPUABRT","tidak","","angkasa","purnama","","2021-08-05 16:45:57","Press Release 	  		  			  		  		 	 Edit  		  		  			  		  		 Delete"
"05-08-2021","16:40:28.7","-4.34","133.82","3.7","17","118 km BaratDaya KAIMANA-PAPUABRT","tidak","","angkasa","purnama","","2021-08-05 16:46:08","Press Release 	  		  			  		  		 	 Edit  		  		  			  		  		 Delete"
"05-08-2021","22:03:58.7","-3.42","134.01","3.3","13","16 km Tenggara KAIMANA-PAPUABRT","tidak","","angkasa","umum","","","Press Release 	  		  			  		  		 	 Edit  		  		  			  		  		 Delete"
"06-08-2021","02:07:06.2","-2.13","136.38","3.4","13","49 km Tenggara KEP-YAPEN-PAPUA","tidak","","angkasa","umum","","","Press Release 	  		  			  		  		 	 Edit  		  		  			  		  		 Delete"
"06-08-2021","02:06:59.6","-2.44","136.97","3.6","10","56 km TimurLaut WAROPEN-PAPUA","tidak","","angkasa","umum","","","Press Release 	  		  			  		  		 	 Edit  		  		  			  		  		 Delete"
"06-08-2021","02:56:16.2","-2.77","140.27","2.1","10","26 km BaratDaya KAB-JAYAPURA-PAPUA","tidak","","angkasa","umum","","","Press Release 	  		  			  		  		 	 Edit  		  		  			  		  		 Delete"
"06-08-2021","12:27:57.5","-3.17","139.70","2.8","26","74 km TimurLaut YALIMO-PAPUA","tidak","","angkasa","umum","","","Press Release 	  		  			  		  		 	 Edit  		  		  			  		  		 Delete"
"06-08-2021","14:54:42.0","-4.36","134.00","3.5","10","119 km Tenggara KAIMANA-PAPUABRT","tidak","","angkasa","umum","","","Press Release 	  		  			  		  		 	 Edit  		  		  			  		  		 Delete"
"06-08-2021","15:06:37.4","-2.62","139.08","2.9","10","89 km Tenggara MAMBERAMOTENGAH-PAPUA","tidak","","angkasa","umum","","","Press Release 	  		  			  		  		 	 Edit  		  		  			  		  		 Delete"
"06-08-2021","15:58:38.6","-4.26","134.02","3.8","19","108 km Tenggara KAIMANA-PAPUABRT","tidak","","angkasa","umum","","","Press Release 	  		  			  		  		 	 Edit  		  		  			  		  		 Delete"
"06-08-2021","16:31:49.9","-0.79","133.30","3.2","10","62 km BaratLaut PEGUNUNGANARFAK-PAPUABRT","tidak","","angkasa","umum","","","Press Release 	  		  			  		  		 	 Edit  		  		  			  		  		 Delete"
"06-08-2021","17:21:51.5","-3.95","134.98","3.7","10","99 km BaratDaya NABIRE-PAPUA","tidak","","angkasa","umum","","","Press Release 	  		  			  		  		 	 Edit  		  		  			  		  		 Delete"
"06-08-2021","17:56:23.9","-4.42","134.49","3.7","10","132 km TimurLaut DOBO-MALUKU","tidak","","angkasa","umum","","","Press Release 	  		  			  		  		 	 Edit  		  		  			  		  		 Delete"
"07-08-2021","11:16:15.4","-2.78","140.52","2.6","10","25 km Tenggara KAB-JAYAPURA-PAPUA","tidak","","angkasa","umum","","","Press Release 	  		  			  		  		 	 Edit  		  		  			  		  		 Delete"
"07-08-2021","12:26:22.3","-3.65","140.10","3.4","10","74 km TimurLaut YALIMO-PAPUA","tidak","","angkasa","umum","","","Press Release 	  		  			  		  		 	 Edit  		  		  			  		  		 Delete"
"07-08-2021","13:40:26.9","-0.48","133.63","4.4","52","57 km BaratLaut PEGUNUNGANARFAK-PAPUABRT","tidak","","angkasa","umum","","","Press Release 	  		  			  		  		 	 Edit  		  		  			  		  		 Delete"
"07-08-2021","18:10:29.7","-2.64","139.62","4.0","24","87 km BaratDaya KAB-JAYAPURA-PAPUA","tidak","","angkasa","umum","","","Press Release 	  		  			  		  		 	 Edit  		  		  			  		  		 Delete"
"08-08-2021","04:11:21.8","-4.51","134.01","3.9","10","120 km BaratLaut DOBO-MALUKU","tidak","","angkasa","umum","","","Press Release 	  		  			  		  		 	 Edit  		  		  			  		  		 Delete"
"08-08-2021","04:56:26.4","-4.34","134.01","3.7","95","117 km Tenggara KAIMANA-PAPUABRT","tidak","","angkasa","umum","","","Press Release 	  		  			  		  		 	 Edit  		  		  			  		  		 Delete"
"08-08-2021","04:56:26.3","-4.40","133.99","3.8","76","124 km Tenggara KAIMANA-PAPUABRT","tidak","","angkasa","umum","","","Press Release 	  		  			  		  		 	 Edit  		  		  			  		  		 Delete"
"08-08-2021","04:56:26.3","-4.40","133.99","3.8","76","124 km Tenggara KAIMANA-PAPUABRT","tidak","","angkasa","umum","","","Press Release 	  		  			  		  		 	 Edit  		  		  			  		  		 Delete"
"08-08-2021","04:56:26.3","-4.40","133.99","3.8","76","124 km Tenggara KAIMANA-PAPUABRT","tidak","","angkasa","umum","","","Press Release 	  		  			  		  		 	 Edit  		  		  			  		  		 Delete"
"08-08-2021","04:56:26.3","-4.40","133.99","3.8","76","124 km Tenggara KAIMANA-PAPUABRT","tidak","","angkasa","umum","","","Press Release 	  		  			  		  		 	 Edit  		  		  			  		  		 Delete"
"08-08-2021","08:31:22.8","-2.02","133.69","1.9","10","22 km TimurLaut TELUKBINTUNI-PAPUABRT","tidak","","angkasa","umum","","","Press Release 	  		  			  		  		 	 Edit  		  		  			  		  		 Delete"
"08-08-2021","20:43:24.1","-3.38","135.51","3.1","10","30 km BaratLaut NABIRE-PAPUA","tidak","","angkasa","umum","","","Press Release 	  		  			  		  		 	 Edit  		  		  			  		  		 Delete"
"09-08-2021","03:55:50.0","-2.85","140.28","2.6","10","33 km BaratDaya KAB-JAYAPURA-PAPUA","tidak","","angkasa","purnama","","2021-08-09 04:06:59","Press Release 	  		  			  		  		 	 Edit  		  		  			  		  		 Delete"
"09-08-2021","05:18:13.6","-2.86","140.37","2.4","10","31 km BaratDaya KAB-JAYAPURA-PAPUA","tidak","","angkasa","purnama","2021-08-09 07:12:33","2021-08-09 07:13:14","Press Release 	  		  			  		  		 	 Edit  		  		  			  		  		 Delete"
"09-08-2021","05:22:00.5","-4.72","133.91","4.0","10","100 km BaratLaut DOBO-MALUKU","tidak","","angkasa","purnama","2021-08-09 07:12:35","2021-08-09 07:13:29","Press Release 	  		  			  		  		 	 Edit  		  		  			  		  		 Delete"
"09-08-2021","05:22:11.6","-4.20","133.99","3.6","10","101 km Tenggara KAIMANA-PAPUABRT","tidak","","angkasa","purnama","2021-08-09 07:12:43","2021-08-09 07:14:02","Press Release 	  		  			  		  		 	 Edit  		  		  			  		  		 Delete"
"10-08-2021","17:55:58.6","-1.52","139.18","4.1","10","60 km TimurLaut SARMI-PAPUA","tidak","","angkasa","umum","","","Press Release 	  		  			  		  		 	 Edit  		  		  			  		  		 Delete"
"10-08-2021","20:17:44.9","-2.55","139.32","3.2","10","100 km Tenggara SARMI-PAPUA","tidak","","angkasa","berlian","2021-08-10 20:29:17","2021-08-10 20:30:18","Press Release 	  		  			  		  		 	 Edit  		  		  			  		  		 Delete"
"11-08-2021","12:15:48.0","-3.51","139.27","3.3","10","29 km TimurLaut KOBAKMA-PAPUA","tidak","","angkasa","umum","","","Press Release 	  		  			  		  		 	 Edit  		  		  			  		  		 Delete"
"11-08-2021","21:42:27.7","-3.71","138.68","3.7","92","34 km Tenggara TOLIKARA-PAPUA","tidak","","angkasa","umum","","","Press Release 	  		  			  		  		 	 Edit  		  		  			  		  		 Delete"
"12-08-2021","02:33:25.4","-3.82","133.84","3.3","10","60 km BaratDaya KAIMANA-PAPUABRT","tidak","","angkasa","umum","","","Press Release 	  		  			  		  		 	 Edit  		  		  			  		  		 Delete"
"12-08-2021","03:00:13.6","-2.13","139.12","3.2","10","51 km Tenggara SARMI-PAPUA","tidak","","angkasa","umum","","","Press Release 	  		  			  		  		 	 Edit  		  		  			  		  		 Delete"
"13-08-2021","19:30:02","-0.80","134.65","3.5","22","29 km BaratLaut Pulau Numfor - PAPUA","tidak","","pgr v","purnama","2021-08-14 06:45:16","2021-08-14 06:45:16","Press Release 	  		  			  		  		 	 Edit  		  		  			  		  		 Delete"
"13-08-2021","14:47:43","-1.42","134.19","4.7","23","8 km TimurLaut RANSIKI-PAPUABRT","dirasakan","Dirasakan di Ransiki III-IV MMI","pgr v","purnama","2021-08-14 06:47:28","2021-08-14 06:47:28","Press Release 	  		  			  		  		 	 Edit  		  		  			  		  		 Delete"
"14-08-2021","12:09:17.0","-0.93","133.94","3.9","10","12 km TimurLaut PEGUNUNGANARFAK-PAPUABRT","tidak","","angkasa","umum","","","Press Release 	  		  			  		  		 	 Edit  		  		  			  		  		 Delete"
"14-08-2021","12:48:25.9","-4.04","134.21","4.7","10","89 km Tenggara KAIMANA-PAPUABRT","tidak","","angkasa","umum","","","Press Release 	  		  			  		  		 	 Edit  		  		  			  		  		 Delete"
"14-08-2021","15:18:50.1","-2.53","140.42","2.3","10","6 km TimurLaut KAB-JAYAPURA-PAPUA","tidak","","angkasa","umum","","","Press Release 	  		  			  		  		 	 Edit  		  		  			  		  		 Delete"
"14-08-2021","21:47:52.1","-2.78","140.42","2.2","10","22 km Tenggara KAB-JAYAPURA-PAPUA","tidak","","angkasa","umum","","","Press Release 	  		  			  		  		 	 Edit  		  		  			  		  		 Delete"
"15-08-2021","00:05:57.7","-3.77","133.79","3.0","13","56 km BaratDaya KAIMANA-PAPUABRT","tidak","","angkasa","umum","","","Press Release 	  		  			  		  		 	 Edit  		  		  			  		  		 Delete"
"15-08-2021","00:07:38.7","-4.29","133.95","3.2","28","111 km Tenggara KAIMANA-PAPUABRT","tidak","","angkasa","umum","","","Press Release 	  		  			  		  		 	 Edit  		  		  			  		  		 Delete"
"15-08-2021","01:56:23.1","-2.65","140.42","2.6","10","8 km Tenggara KAB-JAYAPURA-PAPUA","tidak","","angkasa","umum","","","Press Release 	  		  			  		  		 	 Edit  		  		  			  		  		 Delete"
"15-08-2021","05:02:13.0","-4.38","133.87","3.4","34","122 km BaratDaya KAIMANA-PAPUABRT","tidak","","angkasa","umum","","","Press Release 	  		  			  		  		 	 Edit  		  		  			  		  		 Delete"
"15-08-2021","06:37:58.8","-2.98","139.73","3.1","11","87 km BaratDaya KAB-JAYAPURA-PAPUA","tidak","","angkasa","umum","","","Press Release 	  		  			  		  		 	 Edit  		  		  			  		  		 Delete"
"15-08-2021","09:36:59.1","-2.68","139.29","4.8","30","110 km Tenggara SARMI-PAPUA","tidak","","angkasa","umum","","","Press Release 	  		  			  		  		 	 Edit  		  		  			  		  		 Delete"
"15-08-2021","12:07:28.2","-2.55","134.17","3.7","10","38 km BaratLaut TELUKWONDAMA-PAPUABRT","tidak","","angkasa","purnama","","2021-08-15 12:13:43","Press Release 	  		  			  		  		 	 Edit  		  		  			  		  		 Delete"
"16-08-2021","13:45:19.5","-2.33","140.14","2.4","22","41 km BaratLaut KAB-JAYAPURA-PAPUA","tidak","","angkasa","umum","","","Press Release 	  		  			  		  		 	 Edit  		  		  			  		  		 Delete"
"16-08-2021","18:44:06.9","-2.91","140.27","2.1","8","39 km BaratDaya KAB-JAYAPURA-PAPUA","tidak","","angkasa","umum","","","Press Release 	  		  			  		  		 	 Edit  		  		  			  		  		 Delete"
"16-08-2021","18:59:23.1","-2.32","140.49","2.1","10","30 km BaratLaut KOTA-JAYAPURA-PAPUA","tidak","","angkasa","umum","","","Press Release 	  		  			  		  		 	 Edit  		  		  			  		  		 Delete"
"16-08-2021","20:13:12.6","-2.69","140.38","1.4","10","12 km BaratDaya KAB-JAYAPURA-PAPUA","tidak","","angkasa","umum","","","Press Release 	  		  			  		  		 	 Edit  		  		  			  		  		 Delete"
"16-08-2021","22:04:45.2","-3.15","134.19","3.2","19","31 km TimurLaut KAIMANA-PAPUABRT","tidak","","angkasa","umum","","","Press Release 	  		  			  		  		 	 Edit  		  		  			  		  		 Delete"
"17-08-2021","06:20:39.9","-0.62","132.78","3.2","134","47 km TimurLaut TAMBRAUW-PAPUABRT","tidak","","angkasa","umum","","","Press Release 	  		  			  		  		 	 Edit  		  		  			  		  		 Delete"
"17-08-2021","14:57:16.2","-1.75","139.33","3.1","10","65 km TimurLaut SARMI-PAPUA","tidak","","angkasa","umum","","","Press Release 	  		  			  		  		 	 Edit  		  		  			  		  		 Delete"
"18-08-2021","04:25:43.8","-2.77","133.93","2.8","10","45 km BaratLaut TELUKWONDAMA-PAPUABRT","tidak","","angkasa","umum","","","Press Release 	  		  			  		  		 	 Edit  		  		  			  		  		 Delete"
"18-08-2021","04:41:21.7","-2.85","139.02","3.8","77","91 km BaratLaut KOBAKMA-PAPUA","tidak","","angkasa","umum","","","Press Release 	  		  			  		  		 	 Edit  		  		  			  		  		 Delete"
"18-08-2021","04:41:20.6","-2.93","139.02","3.8","10","82 km BaratLaut KOBAKMA-PAPUA","tidak","","angkasa","umum","","","Press Release 	  		  			  		  		 	 Edit  		  		  			  		  		 Delete"
"18-08-2021","04:41:20.6","-2.93","139.02","3.8","10","82 km BaratLaut KOBAKMA-PAPUA","tidak","","angkasa","umum","","","Press Release 	  		  			  		  		 	 Edit  		  		  			  		  		 Delete"
"18-08-2021","20:46:47.5","-3.05","140.19","2.9","10","57 km BaratDaya KAB-JAYAPURA-PAPUA","tidak","","angkasa","umum","","","Press Release 	  		  			  		  		 	 Edit  		  		  			  		  		 Delete"
"18-08-2021","23:22:35.1","-2.92","129.91","4.6","10","209 km TimurLaut AMBON-MALUKU","tidak","","angkasa","purnama","","2021-08-18 23:46:28","Press Release 	  		  			  		  		 	 Edit  		  		  			  		  		 Delete"
"18-08-2021","23:29:29.9","-2.81","139.10","3.7","10","95 km TimurLaut KOBAKMA-PAPUA","tidak","","angkasa","purnama","","2021-08-18 23:46:35","Press Release 	  		  			  		  		 	 Edit  		  		  			  		  		 Delete"
"18-08-2021","23:32:23.4","-2.87","139.29","3.7","10","92 km TimurLaut KOBAKMA-PAPUA","tidak","","angkasa","purnama","","2021-08-18 23:46:43","Press Release 	  		  			  		  		 	 Edit  		  		  			  		  		 Delete"
"18-08-2021","23:51:00.7","-2.96","138.84","3.1","10","70 km TimurLaut TOLIKARA-PAPUA","tidak","","angkasa","purnama","","2021-08-19 10:25:46","Press Release 	  		  			  		  		 	 Edit  		  		  			  		  		 Delete"
"19-08-2021","00:49:43.4","-3.40","140.01","4.1","10","76 km TimurLaut YALIMO-PAPUA","tidak","","angkasa","purnama","","2021-08-19 10:25:54","Press Release 	  		  			  		  		 	 Edit  		  		  			  		  		 Delete"
"19-08-2021","10:20:15.9","-2.97","140.28","2.5","10","45 km BaratDaya KAB-JAYAPURA-PAPUA","tidak","","angkasa","purnama","","2021-08-19 10:26:02","Press Release 	  		  			  		  		 	 Edit  		  		  			  		  		 Delete"
"19-08-2021","11:56:49.2","-2.00","140.63","2.5","10","63 km TimurLaut KOTA-JAYAPURA-PAPUA","tidak","","angkasa","umum","","","Press Release 	  		  			  		  		 	 Edit  		  		  			  		  		 Delete"
"19-08-2021","13:42:03.6","-1.23","141.08","3.5","10","157 km TimurLaut KOTA-JAYAPURA-PAPUA","tidak","","angkasa","umum","","","Press Release 	  		  			  		  		 	 Edit  		  		  			  		  		 Delete"
"19-08-2021","23:34:09.3","-3.01","140.33","2.1","10","48 km BaratDaya KAB-JAYAPURA-PAPUA","tidak","","angkasa","umum","","","Press Release 	  		  			  		  		 	 Edit  		  		  			  		  		 Delete"
"19-08-2021","12:51:33","-1.85","133.42","4.7","10","30 km BaratLaut TELUKBINTUNI-PAPUABRT","dirasakan","III Bintuni","bmkg","berlian","2021-08-20 00:11:46","2021-08-20 00:12:20","Press Release 	  		  			  		  		 	 Edit  		  		  			  		  		 Delete"
"20-08-2021","03:44:25.9","-4.48","133.98","4.6","10","124 km BaratLaut DOBO-MALUKU","tidak","","angkasa","umum","","","Press Release 	  		  			  		  		 	 Edit  		  		  			  		  		 Delete"
"20-08-2021","12:24:01.1","-1.54","139.40","2.7","10","80 km TimurLaut SARMI-PAPUA","tidak","","angkasa","purnama","","2021-08-20 22:38:49","Press Release 	  		  			  		  		 	 Edit  		  		  			  		  		 Delete"
"20-08-2021","15:51:40.1","-1.34","131.91","1.7","4","45 km BaratDaya MAYBRAT-PAPUABRT","tidak","","pgr v","purnama","2021-08-20 22:38:06","2021-08-20 22:39:00","Press Release 	  		  			  		  		 	 Edit  		  		  			  		  		 Delete"
"21-08-2021","12:13:49.3","-4.08","134.20","3.5","20","92 km Tenggara KAIMANA-PAPUABRT","tidak","","angkasa","umum","","","Press Release 	  		  			  		  		 	 Edit  		  		  			  		  		 Delete"
"21-08-2021","13:09:03.0","-0.96","137.13","3.0","10","119 km TimurLaut BIAK-KOTA-PAPUA","tidak","","angkasa","umum","","","Press Release 	  		  			  		  		 	 Edit  		  		  			  		  		 Delete"
"21-08-2021","15:30:24.2","-4.50","138.69","3.3","10","51 km Tenggara NDUGA-PAPUA","tidak","","angkasa","umum","","","Press Release 	  		  			  		  		 	 Edit  		  		  			  		  		 Delete"
"21-08-2021","16:40:09.3","-3.06","139.87","3.0","9","79 km BaratDaya KAB-JAYAPURA-PAPUA","tidak","","angkasa","umum","","","Press Release 	  		  			  		  		 	 Edit  		  		  			  		  		 Delete"
"21-08-2021","17:41:01.0","-2.61","139.13","3.1","8","94 km Tenggara MAMBERAMOTENGAH-PAPUA","tidak","","angkasa","umum","","","Press Release 	  		  			  		  		 	 Edit  		  		  			  		  		 Delete"
"21-08-2021","19:42:13.2","-3.37","139.79","3.4","10","60 km TimurLaut YALIMO-PAPUA","tidak","","angkasa","umum","","","Press Release 	  		  			  		  		 	 Edit  		  		  			  		  		 Delete"
"21-08-2021","21:50:37.5","-0.49","132.57","2.5","10","38 km TimurLaut TAMBRAUW-PAPUABRT","tidak","","angkasa","umum","","","Press Release 	  		  			  		  		 	 Edit  		  		  			  		  		 Delete"
"21-08-2021","23:00:11.5","-2.30","133.71","2.8","10","31 km Tenggara TELUKBINTUNI-PAPUABRT","tidak","","angkasa","umum","","","Press Release 	  		  			  		  		 	 Edit  		  		  			  		  		 Delete"
"22-08-2021","13:14:05.5","-3.03","140.84","3.4","10","36 km TimurLaut KEEROM-PAPUA","tidak","","angkasa","umum","","","Press Release 	  		  			  		  		 	 Edit  		  		  			  		  		 Delete"
"22-08-2021","15:30:21.9","-1.53","132.30","2.6","10","26 km BaratDaya MAYBRAT-PAPUABRT","tidak","","angkasa","umum","","","Press Release 	  		  			  		  		 	 Edit  		  		  			  		  		 Delete"
"23-08-2021","01:30:50.2","-3.43","138.82","4.2","10","38 km BaratLaut KOBAKMA-PAPUA","tidak","","angkasa","umum","","","Press Release 	  		  			  		  		 	 Edit  		  		  			  		  		 Delete"
"24-08-2021","01:04:57.2","-3.71","135.18","3.5","10","67 km BaratDaya NABIRE-PAPUA","tidak","","angkasa","purnama","","2021-08-24 05:13:58","Press Release 	  		  			  		  		 	 Edit  		  		  			  		  		 Delete"
"24-08-2021","04:44:52.7","-2.25","140.50","3.1","10","37 km BaratLaut KOTA-JAYAPURA-PAPUA","tidak","","angkasa","purnama","","2021-08-24 05:14:05","Press Release 	  		  			  		  		 	 Edit  		  		  			  		  		 Delete"
"24-08-2021","05:05:51.5","-1.53","133.99","4.3","10","19 km BaratDaya RANSIKI-PAPUABRT","tidak","","angkasa","purnama","","2021-08-24 05:14:13","Press Release 	  		  			  		  		 	 Edit  		  		  			  		  		 Delete"
"24-08-2021","12:28:54.8","-2.58","140.19","3.9","10","24 km BaratLaut KAB-JAYAPURA-PAPUA","tidak","","angkasa","umum","","","Press Release 	  		  			  		  		 	 Edit  		  		  			  		  		 Delete"
"24-08-2021","22:56:26.1","-4.31","133.93","4.0","10","114 km BaratDaya KAIMANA-PAPUABRT","tidak","","angkasa","umum","","","Press Release 	  		  			  		  		 	 Edit  		  		  			  		  		 Delete"
"24-08-2021","22:56:26.1","-4.31","133.93","4.0","10","114 km BaratDaya KAIMANA-PAPUABRT","tidak","","angkasa","umum","","","Press Release 	  		  			  		  		 	 Edit  		  		  			  		  		 Delete"
"25-08-2021","00:15:39.4","-2.86","140.79","2.0","10","38 km Tenggara KOTA-JAYAPURA-PAPUA","tidak","","angkasa","umum","","","Press Release 	  		  			  		  		 	 Edit  		  		  			  		  		 Delete"
"25-08-2021","03:11:07.6","-3.00","140.82","2.9","10","39 km TimurLaut KEEROM-PAPUA","dirasakan","di daerah Keerom II  III MMI","angkasa","berlian","","2021-08-25 21:07:24","Press Release 	  		  			  		  		 	 Edit  		  		  			  		  		 Delete"
"25-08-2021","12:30:07.5","-5.89","130.19","4.3","152","263 km BaratLaut SAUMLAKI-MALUKU","tidak","","angkasa","purnama","","2021-08-25 21:03:56","Press Release 	  		  			  		  		 	 Edit  		  		  			  		  		 Delete"
"25-08-2021","13:18:35.2","-1.57","139.05","3.0","10","46 km TimurLaut SARMI-PAPUA","tidak","","angkasa","purnama","","2021-08-25 21:04:07","Press Release 	  		  			  		  		 	 Edit  		  		  			  		  		 Delete"
"25-08-2021","16:10:56.2","-2.58","138.87","2.8","10","65 km Tenggara MAMBERAMOTENGAH-PAPUA","tidak","","angkasa","purnama","","2021-08-25 21:04:24","Press Release 	  		  			  		  		 	 Edit  		  		  			  		  		 Delete"
"25-08-2021","16:03:38.0","-1.76","133.26","2.8","25","47 km BaratLaut TELUKBINTUNI-PAPUABRT","tidak","","angkasa","purnama","2021-08-25 16:44:53","2021-08-25 21:04:15","Press Release 	  		  			  		  		 	 Edit  		  		  			  		  		 Delete"
"25-08-2021","17:59:28.5","-2.68","139.12","2.6","10","95 km Tenggara MAMBERAMOTENGAH-PAPUA","tidak","","pgr v","purnama","2021-08-25 21:03:29","2021-08-25 21:04:51","Press Release 	  		  			  		  		 	 Edit  		  		  			  		  		 Delete"
"26-08-2021","05:38:00.6","-2.29","140.07","4.6","10","49 km BaratLaut KAB-JAYAPURA-PAPUA","tidak","","angkasa","umum","","","Press Release 	  		  			  		  		 	 Edit  		  		  			  		  		 Delete"
"26-08-2021","12:54:43.2","-2.05","140.75","5.3","10","59 km TimurLaut KOTA-JAYAPURA-PAPUA","dirasakan","II-III Jayapura, II-III Sentani","angkasa","gogo","","2021-08-26 13:51:30","Press Release 	  		  			  		  		 	 Edit  		  		  			  		  		 Delete"
"26-08-2021","15:09:20.1","-3.86","139.93","3.0","10","54 km Tenggara YALIMO-PAPUA","tidak","","angkasa","umum","","","Press Release 	  		  			  		  		 	 Edit  		  		  			  		  		 Delete"
"26-08-2021","17:34:15.6","-1.35","132.00","2.3","10","35 km BaratDaya MAYBRAT-PAPUABRT","tidak","","angkasa","umum","","","Press Release 	  		  			  		  		 	 Edit  		  		  			  		  		 Delete"
"26-08-2021","20:33:10.2","-2.80","139.03","4.1","9","92 km Tenggara MAMBERAMOTENGAH-PAPUA","tidak","","angkasa","umum","","","Press Release 	  		  			  		  		 	 Edit  		  		  			  		  		 Delete"
"26-08-2021","19:03:41.1","-1.35","131.95","1.9","10","41 km BaratDaya MAYBRAT-PAPUABRT","tidak","","angkasa","umum","","","Press Release 	  		  			  		  		 	 Edit  		  		  			  		  		 Delete"
"26-08-2021","23:41:38.7","-3.86","136.41","3.8","10","10 km Tenggara PANIAI-PAPUA","tidak","","angkasa","umum","","","Press Release 	  		  			  		  		 	 Edit  		  		  			  		  		 Delete"
"27-08-2021","00:24:31.7","-3.08","139.78","3.0","10","87 km TimurLaut YALIMO-PAPUA","tidak","","angkasa","umum","","","Press Release 	  		  			  		  		 	 Edit  		  		  			  		  		 Delete"
"27-08-2021","05:00:58.6","-3.28","140.54","3.0","10","26 km BaratLaut KEEROM-PAPUA","tidak","","angkasa","umum","","","Press Release 	  		  			  		  		 	 Edit  		  		  			  		  		 Delete"
"27-08-2021","05:38:46.7","-2.61","140.17","3.0","10","26 km BaratDaya KAB-JAYAPURA-PAPUA","tidak","","angkasa","umum","","","Press Release 	  		  			  		  		 	 Edit  		  		  			  		  		 Delete"
"27-08-2021","05:44:20.5","-2.56","140.24","2.8","10","18 km BaratLaut KAB-JAYAPURA-PAPUA","tidak","","angkasa","umum","","","Press Release 	  		  			  		  		 	 Edit  		  		  			  		  		 Delete"
"27-08-2021","16:19:27.1","-4.38","136.97","4.5","10","65 km TimurLaut MIMIKA-PAPUA","tidak","","angkasa","umum","","","Press Release 	  		  			  		  		 	 Edit  		  		  			  		  		 Delete"
"28-08-2021","07:14:05.8","-2.92","138.95","3.4","69","81 km TimurLaut TOLIKARA-PAPUA","tidak","","angkasa","umum","","","Press Release 	  		  			  		  		 	 Edit  		  		  			  		  		 Delete"
"28-08-2021","12:14:46.0","-2.86","140.74","3.3","10","36 km Tenggara KOTA-JAYAPURA-PAPUA","tidak","","angkasa","netty","","2021-08-28 15:38:12","Press Release 	  		  			  		  		 	 Edit  		  		  			  		  		 Delete"
"28-08-2021","12:18:59.1","-3.44","140.37","4.0","10","45 km BaratDaya KEEROM-PAPUA","tidak","","angkasa","netty","","2021-08-28 15:38:47","Press Release 	  		  			  		  		 	 Edit  		  		  			  		  		 Delete"
"28-08-2021","12:27:26.3","-3.51","140.44","6.0","48","40 km BaratDaya KEEROM-PAPUA","dirasakan","di daerah Kota Jayapura, Kab. Jayapura, Keerom, da[...]","angkasa","netty","","2021-08-28 23:36:29","Press Release 	  		  			  		  		 	 Edit  		  		  			  		  		 Delete"
"28-08-2021","12:40:32.4","-2.61","140.22","2.8","10","21 km BaratDaya KAB-JAYAPURA-PAPUA","tidak","","angkasa","netty","","2021-08-28 15:43:16","Press Release 	  		  			  		  		 	 Edit  		  		  			  		  		 Delete"
"28-08-2021","12:47:21.1","-2.83","140.80","3.1","10","36 km Tenggara KOTA-JAYAPURA-PAPUA","tidak","","angkasa","netty","","2021-08-28 15:46:32","Press Release 	  		  			  		  		 	 Edit  		  		  			  		  		 Delete"
"28-08-2021","13:14:51.9","-2.77","140.62","2.6","10","23 km Tenggara KOTA-JAYAPURA-PAPUA","tidak","","angkasa","netty","","2021-08-28 15:46:49","Press Release 	  		  			  		  		 	 Edit  		  		  			  		  		 Delete"
"28-08-2021","13:18:32.8","-2.86","140.75","3.2","8","36 km Tenggara KOTA-JAYAPURA-PAPUA","tidak","","angkasa","umum","","","Press Release 	  		  			  		  		 	 Edit  		  		  			  		  		 Delete"
"28-08-2021","13:18:32.8","-2.86","140.75","3.2","8","36 km Tenggara KOTA-JAYAPURA-PAPUA","tidak","","angkasa","netty","","2021-08-28 15:47:10","Press Release 	  		  			  		  		 	 Edit  		  		  			  		  		 Delete"
"28-08-2021","13:25:27.6","-2.88","140.75","3.6","9","38 km Tenggara KOTA-JAYAPURA-PAPUA","dirasakan","dirasakan di Kota Jayapura III MMI","angkasa","netty","","2021-08-28 23:37:26","Press Release 	  		  			  		  		 	 Edit  		  		  			  		  		 Delete"
"28-08-2021","14:34:36.5","-3.45","140.27","3.8","10","56 km BaratDaya KEEROM-PAPUA","tidak","","angkasa","netty","","2021-08-28 15:48:53","Press Release 	  		  			  		  		 	 Edit  		  		  			  		  		 Delete"
"28-08-2021","14:13:25.5","-3.39","140.39","2.9","10","42 km BaratDaya KEEROM-PAPUA","tidak","","angkasa","netty","2021-08-28 14:41:39","2021-08-28 15:48:43","Press Release 	  		  			  		  		 	 Edit  		  		  			  		  		 Delete"
"28-08-2021","14:28:46.6","-3.10","139.98","2.9","28","74 km BaratDaya KAB-JAYAPURA-PAPUA","tidak","","angkasa","netty","2021-08-28 14:41:41","2021-08-28 15:38:22","Press Release 	  		  			  		  		 	 Edit  		  		  			  		  		 Delete"
"28-08-2021","14:40:08.5","-2.79","140.80","2.3","26","33 km Tenggara KOTA-JAYAPURA-PAPUA","tidak","","angkasa","netty","","2021-08-28 15:49:37","Press Release 	  		  			  		  		 	 Edit  		  		  			  		  		 Delete"
"28-08-2021","14:47:50.2","-3.39","140.33","2.9","10","48 km BaratDaya KEEROM-PAPUA","tidak","","angkasa","netty","2021-08-28 14:56:30","2021-08-28 15:49:26","Press Release 	  		  			  		  		 	 Edit  		  		  			  		  		 Delete"
"28-08-2021","14:53:49.1","-3.41","140.20","3.3","10","63 km BaratDaya KEEROM-PAPUA","tidak","","angkasa","netty","","2021-08-28 15:49:13","Press Release 	  		  			  		  		 	 Edit  		  		  			  		  		 Delete"
"28-08-2021","14:53:49.1","-3.41","140.20","3.3","10","63 km BaratDaya KEEROM-PAPUA","tidak","","angkasa","netty","","2021-08-28 15:49:19","Press Release 	  		  			  		  		 	 Edit  		  		  			  		  		 Delete"
"28-08-2021","14:58:01.1","-3.38","140.13","3.3","10","70 km BaratDaya KEEROM-PAPUA","tidak","","angkasa","netty","","2021-08-28 15:49:03","Press Release 	  		  			  		  		 	 Edit  		  		  			  		  		 Delete"
"28-08-2021","16:15:03.8","-3.20","140.13","2.9","10","72 km BaratLaut KEEROM-PAPUA","tidak","","angkasa","netty","","2021-08-28 16:22:28","Press Release 	  		  			  		  		 	 Edit  		  		  			  		  		 Delete"
"28-08-2021","16:33:36.8","-3.11","139.94","2.6","10","78 km BaratDaya KAB-JAYAPURA-PAPUA","tidak","","angkasa","netty","","2021-08-28 17:25:07","Press Release 	  		  			  		  		 	 Edit  		  		  			  		  		 Delete"
"28-08-2021","16:43:23.1","-3.10","139.95","2.9","10","76 km BaratDaya KAB-JAYAPURA-PAPUA","tidak","","angkasa","netty","","2021-08-28 17:25:15","Press Release 	  		  			  		  		 	 Edit  		  		  			  		  		 Delete"
"28-08-2021","16:55:18.2","-3.29","139.98","2.7","10","81 km TimurLaut YALIMO-PAPUA","tidak","","angkasa","netty","","2021-08-28 17:25:46","Press Release 	  		  			  		  		 	 Edit  		  		  			  		  		 Delete"
"28-08-2021","17:13:37.9","-3.15","140.31","2.6","10","55 km BaratLaut KEEROM-PAPUA","tidak","","angkasa","netty","","2021-08-28 17:25:41","Press Release 	  		  			  		  		 	 Edit  		  		  			  		  		 Delete"
"28-08-2021","17:38:27.2","-3.81","139.72","3.3","10","30 km Tenggara YALIMO-PAPUA","tidak","","angkasa","netty","","2021-08-28 18:35:48","Press Release 	  		  			  		  		 	 Edit  		  		  			  		  		 Delete"
"28-08-2021","17:51:21.2","-3.20","140.19","3.0","10","65 km BaratLaut KEEROM-PAPUA","tidak","","angkasa","netty","","2021-08-28 18:35:56","Press Release 	  		  			  		  		 	 Edit  		  		  			  		  		 Delete"
"28-08-2021","18:18:18.1","-3.41","139.89","2.7","10","64 km TimurLaut YALIMO-PAPUA","tidak","","angkasa","netty","","2021-08-28 18:36:05","Press Release 	  		  			  		  		 	 Edit  		  		  			  		  		 Delete"
"28-08-2021","18:35:39.0","-3.42","140.41","3.6","26","40 km BaratDaya KEEROM-PAPUA","tidak","","angkasa","netty","","2021-08-28 22:11:26","Press Release 	  		  			  		  		 	 Edit  		  		  			  		  		 Delete"
"28-08-2021","19:14:38.0","-3.12","140.02","3.0","9","73 km BaratDaya KAB-JAYAPURA-PAPUA","tidak","","angkasa","netty","","2021-08-28 22:11:37","Press Release 	  		  			  		  		 	 Edit  		  		  			  		  		 Delete"
"28-08-2021","19:30:51.5","-2.23","138.81","3.1","10","42 km Tenggara SARMI-PAPUA","tidak","","angkasa","netty","","2021-08-28 22:12:39","Press Release 	  		  			  		  		 	 Edit  		  		  			  		  		 Delete"
"28-08-2021","21:00:18","-3.44","140.36","5.0","40","46 km BaratDaya KEEROM-PAPUA","dirasakan","Dirasakan II MMI di Keerom dan Wamena","angkasa","netty","","2021-08-28 22:16:06","Press Release 	  		  			  		  		 	 Edit  		  		  			  		  		 Delete"
"28-08-2021","21:12:59.0","-3.39","140.24","3.5","10","58 km BaratDaya KEEROM-PAPUA","tidak","","angkasa","netty","","2021-08-28 22:12:15","Press Release 	  		  			  		  		 	 Edit  		  		  			  		  		 Delete"
"28-08-2021","21:40:29.6","-3.50","140.05","3.1","15","74 km TimurLaut YALIMO-PAPUA","tidak","","angkasa","netty","","2021-08-28 22:47:00","Press Release 	  		  			  		  		 	 Edit  		  		  			  		  		 Delete"
"28-08-2021","21:49:30.8","-1.71","132.29","2.3","10","16 km TimurLaut SORONGSELATAN-PAPUABRT","tidak","","angkasa","netty","","2021-08-28 22:11:50","Press Release 	  		  			  		  		 	 Edit  		  		  			  		  		 Delete"
"28-08-2021","22:17:06.0","-3.44","139.79","2.9","10","54 km TimurLaut YALIMO-PAPUA","tidak","","angkasa","netty","","2021-08-28 22:46:04","Press Release 	  		  			  		  		 	 Edit  		  		  			  		  		 Delete"
"28-08-2021","22:33:38.1","-3.45","140.49","3.1","10","32 km BaratDaya KEEROM-PAPUA","tidak","","angkasa","purnama","","2021-08-28 22:46:43","Press Release 	  		  			  		  		 	 Edit  		  		  			  		  		 Delete"
"29-08-2021","00:49:16.4","-3.48","140.53","2.7","10","30 km BaratDaya KEEROM-PAPUA","tidak","","angkasa","purnama","","2021-08-29 08:32:07","Press Release 	  		  			  		  		 	 Edit  		  		  			  		  		 Delete"
"29-08-2021","02:57:12.9","-3.47","140.55","3.2","10","27 km BaratDaya KEEROM-PAPUA","tidak","","angkasa","purnama","","2021-08-29 08:32:15","Press Release 	  		  			  		  		 	 Edit  		  		  			  		  		 Delete"
"29-08-2021","03:32:25.3","-3.25","140.44","3.3","94","37 km BaratLaut KEEROM-PAPUA","tidak","","angkasa","purnama","","2021-08-29 08:32:28","Press Release 	  		  			  		  		 	 Edit  		  		  			  		  		 Delete"
"29-08-2021","05:21:25.8","-4.55","130.51","4.1","54","275 km Tenggara AMBON-MALUKU","tidak","","angkasa","purnama","","2021-08-29 08:32:35","Press Release 	  		  			  		  		 	 Edit  		  		  			  		  		 Delete"
"29-08-2021","06:21:27.3","-3.27","136.35","3.8","18","51 km BaratLaut INTANJAYA-PAPUA","tidak","","angkasa","purnama","","2021-08-29 08:32:45","Press Release 	  		  			  		  		 	 Edit  		  		  			  		  		 Delete"
"29-08-2021","08:22:05.6","-3.21","140.34","3.5","92","49 km BaratLaut KEEROM-PAPUA","tidak","","angkasa","purnama","","2021-08-29 08:32:53","Press Release 	  		  			  		  		 	 Edit  		  		  			  		  		 Delete"
"29-08-2021","10:11:48.9","-3.46","140.41","4.3","10","41 km BaratDaya KEEROM-PAPUA","tidak","","angkasa","purnama","","2021-08-29 10:24:01","Press Release 	  		  			  		  		 	 Edit  		  		  			  		  		 Delete"
"29-08-2021","11:32:54.3","-2.13","140.11","2.6","10","60 km BaratLaut KAB-JAYAPURA-PAPUA","tidak","","angkasa","umum","","","Press Release 	  		  			  		  		 	 Edit  		  		  			  		  		 Delete"
"29-08-2021","12:50:16.0","-2.23","140.69","2.5","10","38 km TimurLaut KOTA-JAYAPURA-PAPUA","tidak","","angkasa","umum","","","Press Release 	  		  			  		  		 	 Edit  		  		  			  		  		 Delete"
"29-08-2021","13:08:50.6","-3.75","141.82","4.7","10","126 km Tenggara KEEROM-PAPUA","tidak","","angkasa","umum","","","Press Release 	  		  			  		  		 	 Edit  		  		  			  		  		 Delete"
"29-08-2021","14:56:35.7","-2.67","140.62","1.9","10","12 km Tenggara KOTA-JAYAPURA-PAPUA","tidak","","angkasa","umum","","","Press Release 	  		  			  		  		 	 Edit  		  		  			  		  		 Delete"
"29-08-2021","16:32:05.9","-1.89","132.14","2.6","10","14 km BaratDaya SORONGSELATAN-PAPUABRT","tidak","","angkasa","umum","","","Press Release 	  		  			  		  		 	 Edit  		  		  			  		  		 Delete"
"29-08-2021","16:42:02.8","-0.44","132.16","2.0","10","46 km BaratLaut TAMBRAUW-PAPUABRT","tidak","","angkasa","umum","","","Press Release 	  		  			  		  		 	 Edit  		  		  			  		  		 Delete"
"29-08-2021","23:08:35.5","-2.78","142.06","4.3","10","157 km TimurLaut KEEROM-PAPUA","tidak","","angkasa","umum","","","Press Release 	  		  			  		  		 	 Edit  		  		  			  		  		 Delete"
"29-08-2021","23:47:40.9","-4.51","132.67","3.6","10","162 km BaratDaya FAKFAK-PAPUABRT","tidak","","angkasa","umum","","","Press Release 	  		  			  		  		 	 Edit  		  		  			  		  		 Delete"
"30-08-2021","00:53:31.4","-3.48","140.45","4.6","48","38 km BaratDaya KEEROM-PAPUA","tidak","","angkasa","umum","","","Press Release 	  		  			  		  		 	 Edit  		  		  			  		  		 Delete"
"30-08-2021","11:16:17.4","-4.31","137.03","4.1","25","70 km Tenggara DEIYAI-PAPUA","tidak","","angkasa","purnama","","2021-08-30 22:05:49","Press Release 	  		  			  		  		 	 Edit  		  		  			  		  		 Delete"
"30-08-2021","12:33:08.7","-2.92","142.09","4.3","10","155 km TimurLaut KEEROM-PAPUA","tidak","","angkasa","purnama","","2021-08-30 22:05:57","Press Release 	  		  			  		  		 	 Edit  		  		  			  		  		 Delete"
"30-08-2021","14:02:35.8","-4.35","134.11","3.6","19","119 km Tenggara KAIMANA-PAPUABRT","tidak","","angkasa","purnama","","2021-08-30 22:06:07","Press Release 	  		  			  		  		 	 Edit  		  		  			  		  		 Delete"
"30-08-2021","15:10:47.5","-2.83","140.28","1.6","10","31 km BaratDaya KAB-JAYAPURA-PAPUA","tidak","","angkasa","purnama","","2021-08-30 22:06:26","Press Release 	  		  			  		  		 	 Edit  		  		  			  		  		 Delete"
"30-08-2021","14:48:08.1","-0.62","131.84","1.6","10","64 km BaratLaut TAMBRAUW-PAPUABRT","tidak","","angkasa","purnama","2021-08-30 15:21:33","2021-08-30 22:06:17","Press Release 	  		  			  		  		 	 Edit  		  		  			  		  		 Delete"
"30-08-2021","18:38:22.2","-3.09","139.70","3.0","34","82 km TimurLaut YALIMO-PAPUA","tidak","","angkasa","purnama","","2021-08-30 22:06:35","Press Release 	  		  			  		  		 	 Edit  		  		  			  		  		 Delete"
"30-08-2021","19:40:04.2","-3.54","138.40","3.4","69","11 km BaratDaya TOLIKARA-PAPUA","tidak","","angkasa","purnama","","2021-08-30 22:06:43","Press Release 	  		  			  		  		 	 Edit  		  		  			  		  		 Delete"
"30-08-2021","19:49:46.9","-3.45","140.22","3.0","10","61 km BaratDaya KEEROM-PAPUA","tidak","","angkasa","purnama","","2021-08-30 22:06:58","Press Release 	  		  			  		  		 	 Edit  		  		  			  		  		 Delete"
"31-08-2021","00:00:32.9","-2.87","138.93","3.0","10","84 km TimurLaut TOLIKARA-PAPUA","tidak","","angkasa","umum","","","Press Release 	  		  			  		  		 	 Edit  		  		  			  		  		 Delete"
"31-08-2021","02:07:53.4","-2.93","140.79","1.9","10","45 km Tenggara KOTA-JAYAPURA-PAPUA","tidak","","angkasa","umum","","","Press Release 	  		  			  		  		 	 Edit  		  		  			  		  		 Delete"
"31-08-2021","09:22:28.2","-3.43","133.97","4.0","10","16 km Tenggara KAIMANA-PAPUABRT","tidak","","angkasa","umum","","","Press Release 	  		  			  		  		 	 Edit  		  		  			  		  		 Delete"
"31-08-2021","09:38:23.3","-3.46","140.26","3.6","10","57 km BaratDaya KEEROM-PAPUA","tidak","","angkasa","umum","","","Press Release 	  		  			  		  		 	 Edit  		  		  			  		  		 Delete"
"31-08-2021","09:42:59.2","-2.70","139.48","4.1","10","103 km BaratDaya KAB-JAYAPURA-PAPUA","tidak","","angkasa","umum","","","Press Release 	  		  			  		  		 	 Edit  		  		  			  		  		 Delete"
"31-08-2021","11:44:04.2","-0.15","131.96","3.6","24","85 km BaratLaut TAMBRAUW-PAPUABRT","tidak","","angkasa","umum","","","Press Release 	  		  			  		  		 	 Edit  		  		  			  		  		 Delete"
"31-08-2021","13:44:52.9","-4.51","133.55","3.5","53","139 km BaratLaut DOBO-MALUKU","tidak","","angkasa","umum","","","Press Release 	  		  			  		  		 	 Edit  		  		  			  		  		 Delete"
"31-08-2021","14:44:40.8","-2.71","139.21","2.8","10","106 km Tenggara MAMBERAMOTENGAH-PAPUA","tidak","","angkasa","umum","","","Press Release 	  		  			  		  		 	 Edit  		  		  			  		  		 Delete"
"31-08-2021","22:13:17.1","-3.16","140.81","2.8","10","21 km TimurLaut KEEROM-PAPUA","tidak","","PGR V","","2021-09-01 00:38:52","2021-09-01 00:38:52","Press Release 	  		  			  		  		 	 Edit  		  		  			  		  		 Delete"
"01-09-2021","00:24:39.2","-3.14","140.85","2.7","10","25 km TimurLaut KEEROM-PAPUA","tidak","","angkasa","umum","","","Press Release 	  		  			  		  		 	 Edit  		  		  			  		  		 Delete"
"01-09-2021","12:51:15.5","-1.98","138.72","3.6","33","15 km BaratDaya SARMI-PAPUA","tidak","","angkasa","umum","","","Press Release 	  		  			  		  		 	 Edit  		  		  			  		  		 Delete"
"01-09-2021","16:53:54.5","-2.65","138.74","4.1","64","56 km Tenggara MAMBERAMOTENGAH-PAPUA","tidak","","angkasa","umum","","","Press Release 	  		  			  		  		 	 Edit  		  		  			  		  		 Delete"
"02-09-2021","11:57:19.1","-0.89","134.59","3.1","10","32 km BaratLaut Pulau Numfor - PAPUA","tidak","","angkasa","umum","","","Press Release 	  		  			  		  		 	 Edit  		  		  			  		  		 Delete"
"02-09-2021","12:33:32.2","-0.51","132.08","2.4","11","46 km BaratLaut TAMBRAUW-PAPUABRT","tidak","","angkasa","umum","","","Press Release 	  		  			  		  		 	 Edit  		  		  			  		  		 Delete"
"02-09-2021","18:27:43.8","-0.65","132.26","2.3","10","21 km BaratLaut TAMBRAUW-PAPUABRT","tidak","","angkasa","umum","","","Press Release 	  		  			  		  		 	 Edit  		  		  			  		  		 Delete"
"04-09-2021","15:29:40.1","-1.86","133.39","3.2","8","30 km BaratLaut TELUKBINTUNI-PAPUABRT","tidak","","angkasa","purnama","","2021-09-04 22:09:51","Press Release 	  		  			  		  		 	 Edit  		  		  			  		  		 Delete"
"04-09-2021","15:44:37.0","-2.46","140.50","2.4","12","17 km BaratLaut KOTA-JAYAPURA-PAPUA","tidak","","angkasa","purnama","","2021-09-04 22:09:59","Press Release 	  		  			  		  		 	 Edit  		  		  			  		  		 Delete"
"05-09-2021","00:53:10.9","-2.69","140.46","2.3","10","13 km Tenggara KAB-JAYAPURA-PAPUA","tidak","","angkasa","umum","","","Press Release 	  		  			  		  		 	 Edit  		  		  			  		  		 Delete"
"05-09-2021","11:33:00.1","-1.98","136.96","3.0","10","91 km Tenggara KEP-YAPEN-PAPUA","tidak","","angkasa","umum","","","Press Release 	  		  			  		  		 	 Edit  		  		  			  		  		 Delete"
"05-09-2021","20:04:23.8","-1.69","138.92","3.4","10","26 km TimurLaut SARMI-PAPUA","tidak","","angkasa","umum","","","Press Release 	  		  			  		  		 	 Edit  		  		  			  		  		 Delete"
"05-09-2021","23:05:48.2","-2.89","140.29","3.3","10","36 km BaratDaya KAB-JAYAPURA-PAPUA","tidak","","angkasa","umum","","","Press Release 	  		  			  		  		 	 Edit  		  		  			  		  		 Delete"
"05-09-2021","23:14:58.7","-4.09","138.92","2.7","8","2 km BaratLaut WAMENA-PAPUA","tidak","","angkasa","umum","","","Press Release 	  		  			  		  		 	 Edit  		  		  			  		  		 Delete"
"06-09-2021","01:06:16.6","-2.20","138.75","3.4","10","39 km BaratDaya SARMI-PAPUA","tidak","","angkasa","umum","","","Press Release 	  		  			  		  		 	 Edit  		  		  			  		  		 Delete"
"06-09-2021","07:50:58.6","-2.69","140.36","2.4","15","13 km BaratDaya KAB-JAYAPURA-PAPUA","tidak","","angkasa","umum","","","Press Release 	  		  			  		  		 	 Edit  		  		  			  		  		 Delete"
"06-09-2021","11:43:25.8","-0.47","133.93","3.7","10","55 km TimurLaut PEGUNUNGANARFAK-PAPUABRT","tidak","","angkasa","umum","","","Press Release 	  		  			  		  		 	 Edit  		  		  			  		  		 Delete"
"06-09-2021","16:49:38.3","-3.35","140.34","3.6","26","47 km BaratDaya KEEROM-PAPUA","tidak","","angkasa","umum","","","Press Release 	  		  			  		  		 	 Edit  		  		  			  		  		 Delete"
"07-09-2021","00:36:29.6","-4.04","140.07","4.9","93","75 km Tenggara YALIMO-PAPUA","tidak","","angkasa","umum","","","Press Release 	  		  			  		  		 	 Edit  		  		  			  		  		 Delete"
"07-09-2021","06:25:18.5","-2.60","140.18","2.3","10","25 km BaratDaya KAB-JAYAPURA-PAPUA","tidak","","angkasa","umum","","","Press Release 	  		  			  		  		 	 Edit  		  		  			  		  		 Delete"
"07-09-2021","09:58:41.0","-1.98","138.71","3.5","10","15 km BaratDaya SARMI-PAPUA","tidak","","angkasa","umum","","","Press Release 	  		  			  		  		 	 Edit  		  		  			  		  		 Delete"
"07-09-2021","12:46:21.7","-2.87","140.75","2.4","10","37 km Tenggara KOTA-JAYAPURA-PAPUA","tidak","","angkasa","umum","","","Press Release 	  		  			  		  		 	 Edit  		  		  			  		  		 Delete"
"07-09-2021","16:25:03.9","-2.95","139.92","2.6","10","67 km BaratDaya KAB-JAYAPURA-PAPUA","tidak","","angkasa","umum","","","Press Release 	  		  			  		  		 	 Edit  		  		  			  		  		 Delete"
"07-09-2021","22:19:31.8","-3.11","139.95","2.4","10","77 km BaratDaya KAB-JAYAPURA-PAPUA","tidak","","angkasa","umum","","","Press Release 	  		  			  		  		 	 Edit  		  		  			  		  		 Delete"
"07-09-2021","22:21:52.4","-2.88","140.76","2.2","10","39 km Tenggara KOTA-JAYAPURA-PAPUA","tidak","","angkasa","umum","","","Press Release 	  		  			  		  		 	 Edit  		  		  			  		  		 Delete"
"08-09-2021","11:25:10.1","-2.98","140.45","2.6","10","44 km Tenggara KAB-JAYAPURA-PAPUA","tidak","","angkasa","umum","","","Press Release 	  		  			  		  		 	 Edit  		  		  			  		  		 Delete"
"08-09-2021","13:21:48.2","-4.01","136.31","2.8","10","17 km BaratLaut DEIYAI-PAPUA","tidak","","angkasa","umum","","","Press Release 	  		  			  		  		 	 Edit  		  		  			  		  		 Delete"
"08-09-2021","19:21:44.1","-3.68","140.28","3.9","10","65 km BaratDaya KEEROM-PAPUA","tidak","","angkasa","umum","","","Press Release 	  		  			  		  		 	 Edit  		  		  			  		  		 Delete"
"08-09-2021","20:59:19.1","-2.25","140.92","2.7","10","49 km TimurLaut KOTA-JAYAPURA-PAPUA","tidak","","angkasa","umum","","","Press Release 	  		  			  		  		 	 Edit  		  		  			  		  		 Delete"
"09-09-2021","02:12:32.3","-2.29","140.37","3.0","10","33 km BaratLaut KAB-JAYAPURA-PAPUA","tidak","","angkasa","umum","","","Press Release 	  		  			  		  		 	 Edit  		  		  			  		  		 Delete"
"09-09-2021","02:16:32.5","-3.87","134.96","5.5","10","97 km BaratDaya NABIRE-PAPUA","dirasakan","Dirasakan III MMI di Nabire","angkasa","berlian","","2021-09-09 02:26:38","Press Release 	  		  			  		  		 	 Edit  		  		  			  		  		 Delete"
"09-09-2021","04:01:54.6","-2.78","140.77","2.2","10","30 km Tenggara KOTA-JAYAPURA-PAPUA","tidak","","angkasa","umum","","","Press Release 	  		  			  		  		 	 Edit  		  		  			  		  		 Delete"
"09-09-2021","11:59:13.0","-1.50","134.27","3.5","26","12 km Tenggara RANSIKI-PAPUABRT","dirasakan","dirasakan di Distrik Oransbari Kabupaten Manokwari[...]","angkasa","purnama","","2021-09-10 00:43:21","Press Release 	  		  			  		  		 	 Edit  		  		  			  		  		 Delete"
"09-09-2021","12:52:02.4","-1.50","134.19","3.3","33","4 km Tenggara RANSIKI-PAPUABRT","tidak","","angkasa","purnama","","2021-09-09 21:55:13","Press Release 	  		  			  		  		 	 Edit  		  		  			  		  		 Delete"
"09-09-2021","15:22:58.7","-3.95","134.99","4.4","10","98 km BaratDaya NABIRE-PAPUA","tidak","","pgr v","purnama","2021-09-09 21:54:47","2021-09-09 21:55:24","Press Release 	  		  			  		  		 	 Edit  		  		  			  		  		 Delete"
"09-09-2021","16:10:46.6","-2.64","140.31","2.6","10","12 km BaratDaya KAB-JAYAPURA-PAPUA","tidak","","pgr v","purnama","2021-09-09 21:54:49","2021-09-09 21:55:34","Press Release 	  		  			  		  		 	 Edit  		  		  			  		  		 Delete"
"10-09-2021","12:27:47.2","-2.64","140.57","2.0","10","9 km BaratDaya KOTA-JAYAPURA-PAPUA","tidak","","angkasa","umum","","","Press Release 	  		  			  		  		 	 Edit  		  		  			  		  		 Delete"
"10-09-2021","12:59:29.4","-3.85","135.00","3.9","10","92 km BaratDaya NABIRE-PAPUA","tidak","","angkasa","umum","","","Press Release 	  		  			  		  		 	 Edit  		  		  			  		  		 Delete"
"10-09-2021","13:27:42.5","-2.25","137.91","3.6","17","15 km BaratLaut KASONAWEJA-PAPUA","tidak","","angkasa","umum","","","Press Release 	  		  			  		  		 	 Edit  		  		  			  		  		 Delete"
"10-09-2021","13:47:49.6","-1.70","135.00","3.5","14","86 km Tenggara Pulau Numfor - PAPUA","tidak","","angkasa","umum","","","Press Release 	  		  			  		  		 	 Edit  		  		  			  		  		 Delete"
"10-09-2021","16:46:53.1","-2.30","140.32","4.3","10","33 km BaratLaut KAB-JAYAPURA-PAPUA","tidak","","angkasa","umum","","","Press Release 	  		  			  		  		 	 Edit  		  		  			  		  		 Delete"
"10-09-2021","17:36:08.7","-2.28","140.34","3.9","10","34 km BaratLaut KAB-JAYAPURA-PAPUA","tidak","","angkasa","umum","","","Press Release 	  		  			  		  		 	 Edit  		  		  			  		  		 Delete"
"10-09-2021","20:09:03.8","-3.78","155.96","5.1","10","1686 km Tenggara KEEROM-PAPUA","tidak","","angkasa","umum","","","Press Release 	  		  			  		  		 	 Edit  		  		  			  		  		 Delete"
"11-09-2021","10:14:17.8","-2.25","139.24","3.6","86","70 km Tenggara SARMI-PAPUA","tidak","","angkasa","purnama","","2021-09-11 10:21:45","Press Release 	  		  			  		  		 	 Edit  		  		  			  		  		 Delete"
"11-09-2021","16:34:07.5","-2.29","138.91","3.4","55","52 km Tenggara SARMI-PAPUA","tidak","","angkasa","umum","","","Press Release 	  		  			  		  		 	 Edit  		  		  			  		  		 Delete"
"11-09-2021","22:48:04.3","-2.86","139.71","2.8","10","83 km BaratDaya KAB-JAYAPURA-PAPUA","tidak","","angkasa","umum","","","Press Release 	  		  			  		  		 	 Edit  		  		  			  		  		 Delete"
"12-09-2021","10:44:15","-2.73","139.17","4.7","10","102 km Tenggara MAMBERAMOTENGAH-PAPUA","tidak","","pgr v","purnama","2021-09-12 13:06:39","2021-09-12 13:06:39","Press Release 	  		  			  		  		 	 Edit  		  		  			  		  		 Delete"
"12-09-2021","01:46:41.4","-2.36","140.22","2.9","9","32 km BaratLaut KAB-JAYAPURA-PAPUA","tidak","","pgr v","purnama","2021-09-12 13:09:02","2021-09-12 13:09:37","Press Release 	  		  			  		  		 	 Edit  		  		  			  		  		 Delete"
"12-09-2021","05:48:27.0","-0.60","131.44","3.1","10","35 km TimurLaut KOTA-SORONG-PAPUABRT","tidak","","pgr v","purnama","2021-09-12 13:09:04","2021-09-12 13:09:28","Press Release 	  		  			  		  		 	 Edit  		  		  			  		  		 Delete"
"12-09-2021","14:20:45.3","-3.27","141.33","4.0","28","64 km TimurLaut KEEROM-PAPUA","tidak","","angkasa","purnama","","2021-09-12 22:21:35","Press Release 	  		  			  		  		 	 Edit  		  		  			  		  		 Delete"
"12-09-2021","17:31:53","-4.05","134.89","3.4","96","113 km BaratDaya NABIRE-PAPUA","tidak","","pgr v","purnama","2021-09-12 22:21:23","2021-09-12 22:21:23","Press Release 	  		  			  		  		 	 Edit  		  		  			  		  		 Delete"
"13-09-2021","10:53:35.0","-3.05","133.58","3.2","10","48 km BaratLaut KAIMANA-PAPUABRT","tidak","","angkasa","umum","","","Press Release 	  		  			  		  		 	 Edit  		  		  			  		  		 Delete"
"13-09-2021","14:33:27.8","-3.35","139.81","3.4","7","63 km TimurLaut YALIMO-PAPUA","tidak","","angkasa","umum","","","Press Release 	  		  			  		  		 	 Edit  		  		  			  		  		 Delete"
"13-09-2021","14:33:28.0","-3.34","139.83","3.4","10","65 km TimurLaut YALIMO-PAPUA","tidak","","angkasa","umum","","","Press Release 	  		  			  		  		 	 Edit  		  		  			  		  		 Delete"
"13-09-2021","14:37:53.7","-3.52","139.45","3.3","10","29 km TimurLaut YALIMO-PAPUA","tidak","","angkasa","umum","","","Press Release 	  		  			  		  		 	 Edit  		  		  			  		  		 Delete"
"13-09-2021","23:37:51.1","-3.47","140.45","2.8","10","37 km BaratDaya KEEROM-PAPUA","tidak","","angkasa","umum","","","Press Release 	  		  			  		  		 	 Edit  		  		  			  		  		 Delete"
"14-09-2021","00:50:26.8","-3.90","131.98","3.2","31","146 km BaratDaya FAKFAK-PAPUABRT","tidak","","angkasa","umum","","","Press Release 	  		  			  		  		 	 Edit  		  		  			  		  		 Delete"
"14-09-2021","02:07:12.9","-3.52","140.80","3.0","10","20 km Tenggara KEEROM-PAPUA","tidak","","angkasa","umum","","","Press Release 	  		  			  		  		 	 Edit  		  		  			  		  		 Delete"
"14-09-2021","03:23:45.7","-2.87","140.59","2.1","10","34 km BaratDaya KOTA-JAYAPURA-PAPUA","tidak","","angkasa","umum","","","Press Release 	  		  			  		  		 	 Edit  		  		  			  		  		 Delete"
"14-09-2021","04:51:50.3","-3.09","140.26","2.6","10","59 km BaratDaya KAB-JAYAPURA-PAPUA","tidak","","angkasa","umum","","","Press Release 	  		  			  		  		 	 Edit  		  		  			  		  		 Delete"
"14-09-2021","05:53:04.9","-2.28","140.09","2.2","10","48 km BaratLaut KAB-JAYAPURA-PAPUA","tidak","","angkasa","umum","","","Press Release 	  		  			  		  		 	 Edit  		  		  			  		  		 Delete"
"14-09-2021","09:25:38.5","-2.70","140.82","3.4","10","28 km Tenggara KOTA-JAYAPURA-PAPUA","tidak","","angkasa","umum","","","Press Release 	  		  			  		  		 	 Edit  		  		  			  		  		 Delete"
"14-09-2021","09:33:28.3","-3.82","135.02","3.7","10","88 km BaratDaya NABIRE-PAPUA","tidak","","angkasa","umum","","","Press Release 	  		  			  		  		 	 Edit  		  		  			  		  		 Delete"
"14-09-2021","10:44:00.3","-2.49","141.65","3.4","10","116 km TimurLaut KOTA-JAYAPURA-PAPUA","tidak","","angkasa","umum","","","Press Release 	  		  			  		  		 	 Edit  		  		  			  		  		 Delete"
"14-09-2021","11:26:53.6","-1.72","138.20","3.6","10","63 km BaratLaut SARMI-PAPUA","tidak","","angkasa","umum","","","Press Release 	  		  			  		  		 	 Edit  		  		  			  		  		 Delete"
"14-09-2021","13:52:11.6","-2.12","139.27","2.9","65","65 km Tenggara SARMI-PAPUA","tidak","","angkasa","umum","","","Press Release 	  		  			  		  		 	 Edit  		  		  			  		  		 Delete"
"15-09-2021","18:25:16.3","-4.80","138.69","3.3","10","43 km TimurLaut ASMAT-PAPUA","tidak","","angkasa","umum","","","Press Release 	  		  			  		  		 	 Edit  		  		  			  		  		 Delete"
"16-09-2021","00:49:14.9","-3.28","140.08","2.6","10","76 km BaratLaut KEEROM-PAPUA","tidak","","angkasa","umum","","","Press Release 	  		  			  		  		 	 Edit  		  		  			  		  		 Delete"
"16-09-2021","02:39:09.2","-1.74","139.62","2.9","10","97 km TimurLaut SARMI-PAPUA","tidak","","angkasa","umum","","","Press Release 	  		  			  		  		 	 Edit  		  		  			  		  		 Delete"
"16-09-2021","23:00:57.2","-2.80","134.47","1.4","10","17 km TimurLaut TELUKWONDAMA-PAPUABRT","tidak","","angkasa","umum","","","Press Release 	  		  			  		  		 	 Edit  		  		  			  		  		 Delete"
"16-09-2021","23:00:57.2","-2.80","134.47","1.4","10","17 km TimurLaut TELUKWONDAMA-PAPUABRT","tidak","","angkasa","umum","","","Press Release 	  		  			  		  		 	 Edit  		  		  			  		  		 Delete"
"17-09-2021","03:26:15.0","-4.53","138.77","4.0","10","52 km BaratDaya WAMENA-PAPUA","tidak","","angkasa","umum","","","Press Release 	  		  			  		  		 	 Edit  		  		  			  		  		 Delete"
"17-09-2021","17:25:51.1","-1.76","133.62","3.0","10","40 km TimurLaut TELUKBINTUNI-PAPUABRT","tidak","","angkasa","umum","","","Press Release 	  		  			  		  		 	 Edit  		  		  			  		  		 Delete"
"17-09-2021","19:25:55.4","-2.02","136.71","4.4","28","67 km Tenggara KEP-YAPEN-PAPUA","tidak","","angkasa","umum","","","Press Release 	  		  			  		  		 	 Edit  		  		  			  		  		 Delete"
"17-09-2021","22:42:42.8","-2.89","140.30","2.5","7","36 km BaratDaya KAB-JAYAPURA-PAPUA","tidak","","angkasa","purnama","","2021-09-18 10:58:50","Press Release 	  		  			  		  		 	 Edit  		  		  			  		  		 Delete"
"17-09-2021","23:03:17.2","-2.78","140.82","3.3","18","33 km Tenggara KOTA-JAYAPURA-PAPUA","tidak","","angkasa","purnama","","2021-09-18 10:58:42","Press Release 	  		  			  		  		 	 Edit  		  		  			  		  		 Delete"
"18-09-2021","20:24:22.6","-1.49","137.18","4.4","10","116 km TimurLaut KEP-YAPEN-PAPUA","tidak","","angkasa","umum","","","Press Release 	  		  			  		  		 	 Edit  		  		  			  		  		 Delete"
"18-09-2021","22:22:42.2","-1.84","138.35","4.3","10","45 km BaratLaut SARMI-PAPUA","tidak","","angkasa","umum","","","Press Release 	  		  			  		  		 	 Edit  		  		  			  		  		 Delete"
"19-09-2021","01:18:27.8","-3.48","140.29","2.5","9","54 km BaratDaya KEEROM-PAPUA","tidak","","angkasa","umum","","","Press Release 	  		  			  		  		 	 Edit  		  		  			  		  		 Delete"
"19-09-2021","06:07:19.8","-2.69","140.76","2.3","10","22 km Tenggara KOTA-JAYAPURA-PAPUA","tidak","","angkasa","umum","","","Press Release 	  		  			  		  		 	 Edit  		  		  			  		  		 Delete"
"19-09-2021","08:37:05.2","-3.21","139.73","3.5","83","71 km TimurLaut YALIMO-PAPUA","tidak","","angkasa","umum","","","Press Release 	  		  			  		  		 	 Edit  		  		  			  		  		 Delete"
"19-09-2021","16:35:14.3","-2.08","140.53","2.8","10","55 km BaratLaut KOTA-JAYAPURA-PAPUA","tidak","","angkasa","purnama","","2021-09-19 22:41:24","Press Release 	  		  			  		  		 	 Edit  		  		  			  		  		 Delete"
"19-09-2021","17:59:48.3","-1.47","136.98","2.9","23","95 km TimurLaut KEP-YAPEN-PAPUA","tidak","","angkasa","purnama","2021-09-19 18:20:06","2021-09-19 22:41:15","Press Release 	  		  			  		  		 	 Edit  		  		  			  		  		 Delete"
"20-09-2021","19:44:10.4","-2.89","139.90","2.6","47","65 km BaratDaya KAB-JAYAPURA-PAPUA","tidak","","angkasa","umum","","","Press Release 	  		  			  		  		 	 Edit  		  		  			  		  		 Delete"
"21-09-2021","15:13:17.0","-2.02","140.22","2.6","10","66 km BaratLaut KAB-JAYAPURA-PAPUA","tidak","","angkasa","umum","","","Press Release 	  		  			  		  		 	 Edit  		  		  			  		  		 Delete"
"21-09-2021","10:33:23.3","-2.31","140.29","4.9","10","33 km BaratLaut KAB-JAYAPURA-PAPUA","tidak","","BMKG-NBPI","","2021-09-21 11:01:40","2021-09-21 11:01:40","Press Release 	  		  			  		  		 	 Edit  		  		  			  		  		 Delete"
"22-09-2021","00:11:55.3","-2.72","139.65","4.1","69","85 km BaratDaya KAB-JAYAPURA-PAPUA","tidak","","angkasa","umum","","","Press Release 	  		  			  		  		 	 Edit  		  		  			  		  		 Delete"
"23-09-2021","07:07:18.0","-5.47","142.72","5.1","10","264 km TimurLaut BOVENDIGOEL-PAPUA","tidak","","angkasa","umum","","","Press Release 	  		  			  		  		 	 Edit  		  		  			  		  		 Delete"
"24-09-2021","02:10:22.8","-2.68","140.84","2.7","11","28 km Tenggara KOTA-JAYAPURA-PAPUA","tidak","","angkasa","umum","","","Press Release 	  		  			  		  		 	 Edit  		  		  			  		  		 Delete"
"24-09-2021","02:23:28.3","-2.65","139.52","3.8","10","98 km BaratDaya KAB-JAYAPURA-PAPUA","tidak","","angkasa","umum","","","Press Release 	  		  			  		  		 	 Edit  		  		  			  		  		 Delete"
"24-09-2021","02:48:06.6","-2.42","140.26","3.0","10","24 km BaratLaut KAB-JAYAPURA-PAPUA","tidak","","angkasa","umum","","","Press Release 	  		  			  		  		 	 Edit  		  		  			  		  		 Delete"
"24-09-2021","09:23:50.6","-1.85","139.14","3.5","13","43 km TimurLaut SARMI-PAPUA","tidak","","angkasa","umum","","","Press Release 	  		  			  		  		 	 Edit  		  		  			  		  		 Delete"
"24-09-2021","13:27:33.1","-3.01","139.66","2.8","105","89 km TimurLaut YALIMO-PAPUA","tidak","","angkasa","umum","","","Press Release 	  		  			  		  		 	 Edit  		  		  			  		  		 Delete"
"24-09-2021","13:55:46.6","-0.55","131.77","2.3","10","64 km TimurLaut KOTA-SORONG-PAPUABRT","tidak","","angkasa","umum","","","Press Release 	  		  			  		  		 	 Edit  		  		  			  		  		 Delete"
"24-09-2021","14:39:54.5","-2.73","140.50","2.1","6","20 km Tenggara KAB-JAYAPURA-PAPUA","tidak","","angkasa","umum","","","Press Release 	  		  			  		  		 	 Edit  		  		  			  		  		 Delete"
"24-09-2021","23:31:39.4","-3.85","140.41","4.1","10","68 km BaratDaya KEEROM-PAPUA","tidak","","angkasa","umum","","","Press Release 	  		  			  		  		 	 Edit  		  		  			  		  		 Delete"
"25-09-2021","08:57:18.2","-2.61","132.09","2.9","10","94 km BaratDaya SORONGSELATAN-PAPUABRT","tidak","","angkasa","umum","","","Press Release 	  		  			  		  		 	 Edit  		  		  			  		  		 Delete"
"25-09-2021","13:55:45.7","-2.90","140.21","1.9","10","41 km BaratDaya KAB-JAYAPURA-PAPUA","tidak","","angkasa","umum","","","Press Release 	  		  			  		  		 	 Edit  		  		  			  		  		 Delete"
"25-09-2021","13:57:08.4","-2.65","140.34","1.9","10","10 km BaratDaya KAB-JAYAPURA-PAPUA","tidak","","angkasa","umum","","","Press Release 	  		  			  		  		 	 Edit  		  		  			  		  		 Delete"
"26-09-2021","05:08:35.1","-0.98","136.32","3.0","10","35 km TimurLaut BIAK-KOTA-PAPUA","tidak","","angkasa","umum","","","Press Release 	  		  			  		  		 	 Edit  		  		  			  		  		 Delete"
"26-09-2021","05:18:22.7","-0.56","132.09","4.0","10","42 km BaratLaut TAMBRAUW-PAPUABRT","dirasakan","Dirasakan di Sausapor II-III MMI","angkasa","purnama","","2021-10-03 05:52:23","Press Release 	  		  			  		  		 	 Edit  		  		  			  		  		 Delete"
"26-09-2021","11:13:52.3","-2.53","140.72","1.9","10","13 km TimurLaut KOTA-JAYAPURA-PAPUA","tidak","","angkasa","umum","","","Press Release 	  		  			  		  		 	 Edit  		  		  			  		  		 Delete"
"26-09-2021","12:11:43.2","-2.42","140.53","1.9","11","18 km BaratLaut KOTA-JAYAPURA-PAPUA","tidak","","angkasa","umum","","","Press Release 	  		  			  		  		 	 Edit  		  		  			  		  		 Delete"
"26-09-2021","14:37:32.1","-3.45","139.88","2.7","10","61 km TimurLaut YALIMO-PAPUA","tidak","","angkasa","umum","","","Press Release 	  		  			  		  		 	 Edit  		  		  			  		  		 Delete"
"26-09-2021","15:17:49.7","-3.40","140.08","2.8","10","76 km BaratDaya KEEROM-PAPUA","tidak","","angkasa","umum","","","Press Release 	  		  			  		  		 	 Edit  		  		  			  		  		 Delete"
"26-09-2021","17:01:33.8","-2.45","140.26","3.9","10","22 km BaratLaut KAB-JAYAPURA-PAPUA","tidak","","angkasa","umum","","","Press Release 	  		  			  		  		 	 Edit  		  		  			  		  		 Delete"
"26-09-2021","19:43:34.5","-2.93","139.82","3.3","10","75 km BaratDaya KAB-JAYAPURA-PAPUA","tidak","","angkasa","umum","","","Press Release 	  		  			  		  		 	 Edit  		  		  			  		  		 Delete"
"27-09-2021","00:30:43.1","-0.84","138.10","3.8","10","134 km BaratLaut SARMI-PAPUA","tidak","","angkasa","umum","","","Press Release 	  		  			  		  		 	 Edit  		  		  			  		  		 Delete"
"27-09-2021","02:15:40.9","-2.14","139.23","3.6","10","62 km Tenggara SARMI-PAPUA","tidak","","angkasa","umum","","","Press Release 	  		  			  		  		 	 Edit  		  		  			  		  		 Delete"
"27-09-2021","05:45:25.3","-2.90","130.09","3.5","10","228 km TimurLaut AMBON-MALUKU","tidak","","angkasa","umum","","","Press Release 	  		  			  		  		 	 Edit  		  		  			  		  		 Delete"
"27-09-2021","11:26:07.4","-2.63","139.27","2.7","10","104 km Tenggara SARMI-PAPUA","tidak","","angkasa","umum","","","Press Release 	  		  			  		  		 	 Edit  		  		  			  		  		 Delete"
"27-09-2021","11:57:59.9","-2.35","139.21","3.1","10","75 km Tenggara SARMI-PAPUA","tidak","","angkasa","umum","","","Press Release 	  		  			  		  		 	 Edit  		  		  			  		  		 Delete"
"27-09-2021","14:07:51.3","-2.99","140.14","2.6","10","54 km BaratDaya KAB-JAYAPURA-PAPUA","tidak","","angkasa","umum","","","Press Release 	  		  			  		  		 	 Edit  		  		  			  		  		 Delete"
"27-09-2021","15:53:54.0","-2.66","139.23","3.3","10","104 km Tenggara SARMI-PAPUA","tidak","","angkasa","umum","","","Press Release 	  		  			  		  		 	 Edit  		  		  			  		  		 Delete"
"27-09-2021","21:08:00.6","-0.30","132.75","2.8","10","67 km TimurLaut TAMBRAUW-PAPUABRT","tidak","","angkasa","umum","","","Press Release 	  		  			  		  		 	 Edit  		  		  			  		  		 Delete"
"27-09-2021","21:15:49.5","-2.16","138.83","3.1","10","35 km Tenggara SARMI-PAPUA","tidak","","angkasa","umum","","","Press Release 	  		  			  		  		 	 Edit  		  		  			  		  		 Delete"
"28-09-2021","02:49:30.7","-1.75","138.17","4.0","10","63 km TimurLaut KASONAWEJA-PAPUA","tidak","","angkasa","purnama","","2021-10-03 05:50:42","Press Release 	  		  			  		  		 	 Edit  		  		  			  		  		 Delete"
"28-09-2021","03:57:41.8","-2.35","140.12","3.2","8","41 km BaratLaut KAB-JAYAPURA-PAPUA","tidak","","angkasa","purnama","","2021-09-28 04:14:10","Press Release 	  		  			  		  		 	 Edit  		  		  			  		  		 Delete"
"28-09-2021","13:21:19.1","-3.23","141.22","3.2","10","52 km TimurLaut KEEROM-PAPUA","tidak","","angkasa","umum","","","Press Release 	  		  			  		  		 	 Edit  		  		  			  		  		 Delete"
"29-09-2021","10:42:25.3","-0.53","132.37","2.4","10","28 km BaratLaut TAMBRAUW-PAPUABRT","tidak","","angkasa","purnama","","2021-09-29 11:01:48","Press Release 	  		  			  		  		 	 Edit  		  		  			  		  		 Delete"
"29-09-2021","15:34:29.0","-3.60","141.34","3.4","27","70 km Tenggara KEEROM-PAPUA","tidak","","angkasa","purnama","","2021-09-29 15:48:21","Press Release 	  		  			  		  		 	 Edit  		  		  			  		  		 Delete"
"29-09-2021","15:55:53.2","-3.55","140.42","3.0","40","44 km BaratDaya KEEROM-PAPUA","tidak","","angkasa","purnama","","2021-09-29 16:12:13","Press Release 	  		  			  		  		 	 Edit  		  		  			  		  		 Delete"
"29-09-2021","19:41:04.3","-2.34","140.51","3.9","10","27 km BaratLaut KOTA-JAYAPURA-PAPUA","dirasakan","Di Kota Jayapura II MMI","angkasa","purnama","","2021-09-29 20:30:28","Press Release 	  		  			  		  		 	 Edit  		  		  			  		  		 Delete"
"30-09-2021","00:03:54.4","-2.58","139.50","2.8","38","100 km BaratLaut KAB-JAYAPURA-PAPUA","tidak","","angkasa","umum","","","Press Release 	  		  			  		  		 	 Edit  		  		  			  		  		 Delete"
"30-09-2021","00:07:11.6","-2.17","139.31","3.0","58","71 km Tenggara SARMI-PAPUA","tidak","","angkasa","umum","","","Press Release 	  		  			  		  		 	 Edit  		  		  			  		  		 Delete"
"30-09-2021","05:37:43.7","-2.79","140.28","2.4","10","27 km BaratDaya KAB-JAYAPURA-PAPUA","tidak","","angkasa","umum","","","Press Release 	  		  			  		  		 	 Edit  		  		  			  		  		 Delete"
"30-09-2021","05:54:25.2","-2.22","140.58","2.4","10","39 km BaratLaut KOTA-JAYAPURA-PAPUA","tidak","","angkasa","umum","","","Press Release 	  		  			  		  		 	 Edit  		  		  			  		  		 Delete"
"01-10-2021","01:54:13.5","-2.21","139.75","3.4","10","84 km BaratLaut KAB-JAYAPURA-PAPUA","tidak","","angkasa","umum","","","Press Release 	  		  			  		  		 	 Edit  		  		  			  		  		 Delete"
"01-10-2021","04:16:55.6","-1.85","136.13","4.0","10","12 km BaratDaya KEP-YAPEN-PAPUA","dirasakan","","angkasa","berlian","","2021-10-07 23:03:11","Press Release 	  		  			  		  		 	 Edit  		  		  			  		  		 Delete"
"01-10-2021","11:04:35.7","-4.38","139.48","3.4","10","14 km BaratLaut YAHUKIMO-PAPUA","tidak","","angkasa","umum","","","Press Release 	  		  			  		  		 	 Edit  		  		  			  		  		 Delete"
"01-10-2021","13:06:01.4","-2.21","139.91","2.7","10","69 km BaratLaut KAB-JAYAPURA-PAPUA","tidak","","angkasa","umum","","","Press Release 	  		  			  		  		 	 Edit  		  		  			  		  		 Delete"
"01-10-2021","14:00:44.0","-2.56","133.99","2.7","10","49 km BaratLaut TELUKWONDAMA-PAPUABRT","tidak","","angkasa","umum","","","Press Release 	  		  			  		  		 	 Edit  		  		  			  		  		 Delete"
"02-10-2021","00:56:29.9","-2.67","138.92","3.9","10","74 km Tenggara MAMBERAMOTENGAH-PAPUA","tidak","","angkasa","umum","","","Press Release 	  		  			  		  		 	 Edit  		  		  			  		  		 Delete"
"02-10-2021","01:08:25.0","-1.80","140.49","3.7","10","86 km BaratLaut KOTA-JAYAPURA-PAPUA","tidak","","angkasa","umum","","","Press Release 	  		  			  		  		 	 Edit  		  		  			  		  		 Delete"
"02-10-2021","18:50:22.2","-2.74","140.53","1.9","10","21 km BaratDaya KOTA-JAYAPURA-PAPUA","tidak","","angkasa","umum","","","Press Release 	  		  			  		  		 	 Edit  		  		  			  		  		 Delete"
"02-10-2021","19:45:54.0","-2.51","138.18","3.3","10","22 km BaratDaya MAMBERAMOTENGAH-PAPUA","tidak","","angkasa","umum","","","Press Release 	  		  			  		  		 	 Edit  		  		  			  		  		 Delete"
"03-10-2021","01:38:45.5","-2.48","136.53","3.9","38","43 km BaratLaut WAROPEN-PAPUA","tidak","","angkasa","purnama","","2021-10-03 01:47:56","Press Release 	  		  			  		  		 	 Edit  		  		  			  		  		 Delete"
"03-10-2021","01:56:28.4","-2.20","140.48","3.2","10","43 km BaratLaut KOTA-JAYAPURA-PAPUA","tidak","","angkasa","purnama","","2021-10-04 12:38:02","Press Release 	  		  			  		  		 	 Edit  		  		  			  		  		 Delete"
"03-10-2021","02:00:59.3","-2.13","140.49","3.2","10","50 km BaratLaut KOTA-JAYAPURA-PAPUA","tidak","","angkasa","purnama","","2021-10-04 12:38:09","Press Release 	  		  			  		  		 	 Edit  		  		  			  		  		 Delete"
"03-10-2021","02:38:14.0","-2.81","140.53","1.9","10","29 km BaratDaya KOTA-JAYAPURA-PAPUA","tidak","","angkasa","purnama","","2021-10-04 12:38:15","Press Release 	  		  			  		  		 	 Edit  		  		  			  		  		 Delete"
"03-10-2021","02:53:51.0","-2.78","140.55","1.9","10","25 km BaratDaya KOTA-JAYAPURA-PAPUA","tidak","","angkasa","purnama","","2021-10-04 12:38:27","Press Release 	  		  			  		  		 	 Edit  		  		  			  		  		 Delete"
"03-10-2021","05:51:13.7","-2.74","139.38","4.2","23","109 km TimurLaut KOBAKMA-PAPUA","tidak","","angkasa","purnama","","2021-10-04 12:38:44","Press Release 	  		  			  		  		 	 Edit  		  		  			  		  		 Delete"
"03-10-2021","13:33:56.7","-2.07","138.68","3.6","10","25 km BaratDaya SARMI-PAPUA","tidak","","angkasa","umum","","","Press Release 	  		  			  		  		 	 Edit  		  		  			  		  		 Delete"
"04-10-2021","00:51:22.4","-1.98","138.50","4.3","52","31 km BaratDaya SARMI-PAPUA","tidak","","angkasa","umum","","","Press Release 	  		  			  		  		 	 Edit  		  		  			  		  		 Delete"
"04-10-2021","12:23:36.7","-2.77","139.17","3.3","8","100 km TimurLaut KOBAKMA-PAPUA","tidak","","angkasa","purnama","","2021-10-04 12:39:05","Press Release 	  		  			  		  		 	 Edit  		  		  			  		  		 Delete"
"04-10-2021","15:28:08.4","-1.88","139.09","3.5","18","38 km Tenggara SARMI-PAPUA","tidak","","angkasa","purnama","","2021-10-04 16:00:35","Press Release 	  		  			  		  		 	 Edit  		  		  			  		  		 Delete"
